NSW:NSW:NSW 355607,PhysicalObject,2018-01-31 09:56:00.0,NSW,NSW,PreservedSpecimen,NSW:NSW:NSW 355607,NSW 355607,"[Specimen sent to Kew, no 691.] [ex Herbarium of F.A. Rodway, No. 3339]",691,"Rodway, F.A.",,buds | flowers,native,Present,sheet,,,,1932-01-23,,,,,,,,Australia,,New South Wales,,"Burrier Rd, 3 miles [4.8 km] SW of Nowra","Burrier Rd, 3 miles [4.8 km] SW of Nowra",,,,,,,,"34,55,,S,150,33,,E,",,,,,-34.92,150.55,,10000.0,,,,,,,,,,,,,,Angophora floribunda (Sm.) Sweet,,,,,Myrtaceae,Angophora,floribunda,,,(Sm.) Sweet,
NSW:NSW:NSW 355608,PhysicalObject,2018-01-31 09:56:00.0,NSW,NSW,PreservedSpecimen,NSW:NSW:NSW 355608,NSW 355608,"A large tree. [ex Herbarium of F.A. Rodway, No. 14459]",,"Rodway, F.A.",,fruit,native,Present,sheet,,,,1947-05-21,,Cleared ground. Badly infested by Loranthus longiflorus. Capsules covering ground at the base of trunk.,,,,,,Australia,,New South Wales,,"The Pound, abt 2 miles [3.2 km] S of Nowra","The Pound, abt 2 miles [3.2 km] S of Nowra",,,,,,,,"34,55,,S,150,36,,E,",,,,,-34.92,150.6,,10000.0,,,,,,,,,,,,,,Angophora floribunda (Sm.) Sweet,,,,,Myrtaceae,Angophora,floribunda,,,(Sm.) Sweet,
NSW:NSW:NSW 355609,PhysicalObject,2014-04-27 15:13:00.0,NSW,NSW,PreservedSpecimen,NSW:NSW:NSW 355609,NSW 355609,Small tree c. 4 m high.,124,"Austin, M.P.",,fruit,,Present,sheet,,,,1973-05-05,,Logged forest of Eucalyptus sieberi - E. muelleriana - E. cypellocarpa on ordovician metamorphics.,,,,,,Australia,,New South Wales,Bodalla State Forest,c. 6 km north-northwest of Narooma,c. 6 km north-northwest of Narooma,,100.0,100.0,,,,,"36,10,,S,150,06,,E,",,,,,-36.17,150.1,,10000.0,,,,,,,,,,,,,,Angophora floribunda (Sm.) Sweet,,,,,Myrtaceae,Angophora,floribunda,,,(Sm.) Sweet,
NSW:NSW:NSW 355610,PhysicalObject,2014-11-25 12:54:00.0,NSW,NSW,PreservedSpecimen,NSW:NSW:NSW 355610,NSW 355610,Small tree with rough bark and discolorous leaves.,2959,"Adams, L.G.",,buds | flowers,,Present,sheet,,,,1973-02-04,,Casuarina heath with scattered Eucalyptus angophoroides: occasional.,,,,,,Australia,,New South Wales,,c. 16.5 km north-northeast of Cobargo,c. 16.5 km north-northeast of Cobargo,,130.0,130.0,,,,,"36,15,,S,149,58,,E,",,,,,-36.25,149.97,,10000.0,,,,,,,,,,,,,,Angophora floribunda (Sm.) Sweet,,,,,Myrtaceae,Angophora,floribunda,,,(Sm.) Sweet,
NSW:NSW:NSW 355611,PhysicalObject,2014-04-27 15:13:00.0,NSW,NSW,PreservedSpecimen,NSW:NSW:NSW 355611,NSW 355611,Typical rough-barked apple - small form.,,"Johnson, L.A.S.",,,native,Present,sheet,,,,1950-02-20,,On sandstone near sea. Occurs sporadically throughout.,,,,,,Australia,,New South Wales,,near Wallaga Lake (N of Bermagui),near Wallaga Lake (N of Bermagui),,,,,,,,"36,22,,S,150,04,,E,",,,,,-36.37,150.07,,10000.0,,,,,,,,,,,,,,Angophora floribunda (Sm.) Sweet,,,,,Myrtaceae,Angophora,floribunda,,,(Sm.) Sweet,
NSW:NSW:NSW 355612,PhysicalObject,2014-05-26 11:35:00.0,NSW,NSW,PreservedSpecimen,NSW:NSW:NSW 355612,NSW 355612,[ex CBG 000582],5,"Phillips, M.E.",,fruit,native,Present,sheet,,,,1963-04-01,,"Cleared country, granite.",,,,,,Australia,,New South Wales,,"Bega, past turn of Snowy Mountains Highway, toward Brown Mountain - on highway","Bega, past turn of Snowy Mountains Highway, toward Brown Mountain - on highway",,,,,,,,"36,41,,S,149,51,,E,",,,,,-36.68,149.85,,10000.0,,,,,,,,,,,,,,Angophora floribunda (Sm.) Sweet,,,,,Myrtaceae,Angophora,floribunda,,,(Sm.) Sweet,
NSW:NSW:NSW 355613,PhysicalObject,2018-01-31 09:56:00.0,NSW,NSW,PreservedSpecimen,NSW:NSW:NSW 355613,NSW 355613,"[ex Herbarium of F.A. Rodway, No. 3351]",,"Rodway, F.A.",,buds,native,Present,sheet,,,,1923-01,,,,,,,,Australia,,New South Wales,,Bega - Pambula road,Bega - Pambula road,,,,,,,,"36,48,,S,149,49,,E,",,,,,-36.8,149.82,,25000.0,,,,,,,,,,,,,,Angophora floribunda (Sm.) Sweet,,,,,Myrtaceae,Angophora,floribunda,,,(Sm.) Sweet,
NSW:NSW:NSW 355614,PhysicalObject,2014-04-27 15:13:00.0,NSW,NSW,PreservedSpecimen,NSW:NSW:NSW 355614,NSW 355614,,,"Johnson, L.A.S.",,fruit,native,Present,sheet,,,,1950-11-23,,Common through the district in many communities.,,,,,,Australia,,New South Wales,,1 m [1.6 km] W of Tathra,1 m [1.6 km] W of Tathra,,,,,,,,"36,44,,S,149,58,,E,",,,,,-36.73,149.97,,10000.0,,,,,,,,,,,,,,Angophora floribunda (Sm.) Sweet,,,,,Myrtaceae,Angophora,floribunda,,,(Sm.) Sweet,
NSW:NSW:NSW 355615,PhysicalObject,2018-06-26 12:56:00.0,NSW,NSW,PreservedSpecimen,NSW:NSW:NSW 355615,NSW 355615,"The only Apple growing on the mount bark of tree rough, but becomes much stunted in growth as it reaches higher up the mount this particular specimen was obtained almost on the top. The plant being little more than a sapling of 10-12 ft [3-3.6 m] high.",,"Boorman, J.L.",,buds | flowers,native,Present,sheet,,,,1916-12,,,,,,,,Australia,,New South Wales,,Mt Imlay near Eden,Mt Imlay near Eden,,,,,,,,"37,10,,S,149,40,,E,",,,,,-37.17,149.67,,10000.0,,,,,,,,,,,,,,Angophora floribunda (Sm.) Sweet,,,,,Myrtaceae,Angophora,floribunda,,,(Sm.) Sweet,
NSW:NSW:NSW 355616,PhysicalObject,2014-04-27 15:13:00.0,NSW,NSW,PreservedSpecimen,NSW:NSW:NSW 355616,NSW 355616,Tree to 30 ft [9.1 m] - fibrous flaky bark.,2842,"Whaite, T.M.",,buds | flowers | fruit,native,Present,sheet,,,,1965-01-10,,Infrequent - in colony near beach dunes.,,,,,,Australia,,New South Wales,,Wally Newtons Inlet - Nadgee Faunal Reserve [Nadgee Inlet],Wally Newtons Inlet - Nadgee Faunal Reserve [Nadgee Inlet],,,,,,,,"37,28,,S,149,58,,E,",,,,,-37.47,149.97,,10000.0,,,,,,,,,,,,,,Angophora floribunda (Sm.) Sweet,,,,,Myrtaceae,Angophora,floribunda,,,(Sm.) Sweet,
NSW:NSW:NSW 355617,PhysicalObject,2014-04-27 15:13:00.0,NSW,NSW,PreservedSpecimen,NSW:NSW:NSW 355617,NSW 355617,Tree to 10 m.,1505,"Chapman, A.D.",,fruit,,Present,sheet,,,,1979-10-01,,,,,,,,Australia,,New South Wales,,"7 km E of Olinda on junction of track to Kandos Wier Picnic area and Mt Coricudgy Rd, Rylstone district","7 km E of Olinda on junction of track to Kandos Wier Picnic area and Mt Coricudgy Rd, Rylstone district",,715.0,715.0,,,,,"32,51,30,S,150,12,20,E,",,,,,-32.8583333,150.2055556,,50.0,,,,,,,,,,,,,,Angophora floribunda (Sm.) Sweet,,,,,Myrtaceae,Angophora,floribunda,,,(Sm.) Sweet,
NSW:NSW:NSW 355618,PhysicalObject,2018-07-25 09:01:00.0,NSW,NSW,PreservedSpecimen,NSW:NSW:NSW 355618,NSW 355618,Small tree.,1404,"Benson, D.H.",,sterile,,Present,sheet,,,,1983-05-10,,On edge of basalt clearing beside track. Growing with E. blakelyi here but elsewhere found scattered on sandstone ridges with E. oblonga and Angophora costata.,,,,,,Australia,,New South Wales,,"Gospers Mountain, northeast of Glen Davis","Gospers Mountain, northeast of Glen Davis",,780.0,780.0,,,,,"33,02,,S,150,24,,E,",,,,,-33.03,150.4,,1000.0,,,,,,,,,,,,,,Angophora floribunda (Sm.) Sweet,,,,,Myrtaceae,Angophora,floribunda,,,(Sm.) Sweet,
NSW:NSW:NSW 355619,PhysicalObject,2017-02-01 14:51:00.0,NSW,NSW,PreservedSpecimen,NSW:NSW:NSW 355619,NSW 355619,,,"Wiburd, J.C.",,buds,native,Present,sheet,,,,1936-12,,,,,,,,Australia,,New South Wales,,Hill End.,Hill End.,,,,,,,,"33,02,,S,149,25,,E,",,,,,-33.03,149.42,,10000.0,,,,,,,,,,,,,,Angophora floribunda (Sm.) Sweet,,,,,Myrtaceae,Angophora,floribunda,,,(Sm.) Sweet,
NSW:NSW:NSW 355620,PhysicalObject,2018-06-26 12:56:00.0,NSW,NSW,PreservedSpecimen,NSW:NSW:NSW 355620,NSW 355620,,,"Maiden, J.H.",,fruit,native,Present,sheet,,,,1901-03,,,,,,,,Australia,,New South Wales,,Capertee.,Capertee.,,,,,,,,"33,09,,S,149,59,,E,",,,,,-33.15,149.98,,10000.0,,,,,,,,,,,,,,Angophora floribunda (Sm.) Sweet,,,,,Myrtaceae,Angophora,floribunda,,,(Sm.) Sweet,
NSW:NSW:NSW 355621,PhysicalObject,2018-06-26 12:56:00.0,NSW,NSW,PreservedSpecimen,NSW:NSW:NSW 355621,NSW 355621,"Apple. Fairly plentiful, attaining fair size trees. Useful for knaves of wheels tc.",13,"Boorman, J.L.",,buds | fruit,native,Present,sheet,,,,1900-01-10,,,,,,,,Australia,,New South Wales,,Capertee.,Capertee.,,,,,,,,"33,09,,S,149,59,,E,",,,,,-33.15,149.98,,10000.0,,,,,,,,,,,,,,Angophora floribunda (Sm.) Sweet,,,,,Myrtaceae,Angophora,floribunda,,,(Sm.) Sweet,
NSW:NSW:NSW 355622,PhysicalObject,2014-04-27 15:13:00.0,NSW,NSW,PreservedSpecimen,NSW:NSW:NSW 355622,NSW 355622,,,Luther,,buds | flowers,native,Present,sheet,,,,1927-04-08,,,,,,,,Australia,,New South Wales,,near Bathurst,near Bathurst,,,,,,,,"33,25,,S,149,35,,E,",,,,,-33.42,149.58,,10000.0,,,,,,,,,,,,,,Angophora floribunda (Sm.) Sweet,,,,,Myrtaceae,Angophora,floribunda,,,(Sm.) Sweet,
NSW:NSW:NSW 355623,PhysicalObject,2014-04-27 15:13:00.0,NSW,NSW,PreservedSpecimen,NSW:NSW:NSW 355623,NSW 355623,"[Bathurst to Sofala, via Peel and Wattle Flat, returning via Limekilns. (On the track taken by Allan Cunningham in April, 1823. See his Journal of a route from Bathurst to Liverpool Plains, as described by him in Barron Fields Geog. Memoirs on N.S.W. pp. 133, &c.)]",,"Maiden, J.H.",,fruit,native,Present,sheet,,,,1910-03,,,,,,,,Australia,,New South Wales,,Wimburndale,Wimburndale,,,,,,,,"33,17,,S,149,35,,E,",,,,,-33.28,149.58,,10000.0,,,,,,,,,,,,,,Angophora floribunda (Sm.) Sweet,,,,,Myrtaceae,Angophora,floribunda,,,(Sm.) Sweet,
NSW:NSW:NSW 355624,PhysicalObject,2014-04-27 15:13:00.0,NSW,NSW,PreservedSpecimen,NSW:NSW:NSW 355624,NSW 355624,Apple,,"Musson, C.T.",,fruit,native,Present,sheet,,,,1905-07,,,,,,,,Australia,,New South Wales,,Bathurst,Bathurst,,,,,,,,"33,25,,S,149,35,,E,",,,,,-33.42,149.58,,10000.0,,,,,,,,,,,,,,Angophora floribunda (Sm.) Sweet,,,,,Myrtaceae,Angophora,floribunda,,,(Sm.) Sweet,
NSW:NSW:NSW 355625,PhysicalObject,2014-04-27 15:13:00.0,NSW,NSW,PreservedSpecimen,NSW:NSW:NSW 355625,NSW 355625,Large bushy tree with dense foliage - a lone specimen - rough barked apple.,,"Gregson, E.J.",,fruit,native,Present,sheet,,,,1949-03,,,,,,,,Australia,,New South Wales,,"foot of Mt Tomah, eastern side","foot of Mt Tomah, eastern side",,,,,,,,"33,33,,S,150,25,,E,",,,,,-33.55,150.42,,10000.0,,,,,,,,,,,,,,Angophora floribunda (Sm.) Sweet,,,,,Myrtaceae,Angophora,floribunda,,,(Sm.) Sweet,
NSW:NSW:NSW 355626,PhysicalObject,2014-04-27 15:13:00.0,NSW,NSW,PreservedSpecimen,NSW:NSW:NSW 355626,NSW 355626,"Angophora sp. seems to be intermediate between A. intermedia & A. lanceolata. The bark is scaly on young trees, scaly to rough on old one on stem & large branches, secondary branches either smooth or scaly barked.",,"Blakely, W.F.",,fruit,native,Present,sheet,,,,1938-03-12,,,,,,,,Australia,,New South Wales,,"Federal Pass, Wentworth Falls","Federal Pass, Wentworth Falls",,,,,,,,"33,43,,S,150,22,,E,",,,,,-33.72,150.37,,10000.0,,,,,,,,,,,,,,Angophora floribunda (Sm.) Sweet,,,,,Myrtaceae,Angophora,floribunda,,,(Sm.) Sweet,
NSW:NSW:NSW 355627,PhysicalObject,2018-02-05 14:36:00.0,NSW,NSW,PreservedSpecimen,NSW:NSW:NSW 355627,NSW 355627,Apple tree - coarse bark.,,"Cheel, E.",,,native,Present,sheet,,,,1912-01,,,,,,,,Australia,,New South Wales,,Nattai River near Emmells,Nattai River near Emmells,,,,,,,,"34,04,,S,150,26,,E,",,,,,-34.07,150.43,,10000.0,,,,,,,,,,,,,,Angophora floribunda (Sm.) Sweet,,,,,Myrtaceae,Angophora,floribunda,,,(Sm.) Sweet,
NSW:NSW:NSW 355628,PhysicalObject,2018-02-05 14:36:00.0,NSW,NSW,PreservedSpecimen,NSW:NSW:NSW 355628,NSW 355628,Trunk has a very coarse rough bark.,,"Cheel, E.",,buds,native,Present,sheet,,,,1919-12-26,,,,,,,,Australia,,New South Wales,,Colo via Hill Top,Colo via Hill Top,,,,,,,,"34,22,30,S,150,29,,E,",,,,,-34.375,150.48,,10000.0,,,,,,,,,,,,,,Angophora floribunda (Sm.) Sweet,,,,,Myrtaceae,Angophora,floribunda,,,(Sm.) Sweet,
NSW:NSW:NSW 355629,PhysicalObject,2018-02-05 14:36:00.0,NSW,NSW,PreservedSpecimen,NSW:NSW:NSW 355629,NSW 355629,"With very coarse, deeply furrowed bark.",,"Cheel, E.",,fruit,native,Present,sheet,,,,1913-06,,,,,,,,Australia,,New South Wales,,Colo [Colo Vale],Colo [Colo Vale],,,,,,,,"34,24,,S,150,29,,E,",,,,,-34.4,150.48,,10000.0,,,,,,,,,,,,,,Angophora floribunda (Sm.) Sweet,,,,,Myrtaceae,Angophora,floribunda,,,(Sm.) Sweet,
NSW:NSW:NSW 355630,PhysicalObject,2014-04-27 15:13:00.0,NSW,NSW,PreservedSpecimen,NSW:NSW:NSW 355630,NSW 355630,"Rough-barked trees, spreading, to 15 m. (Just reach Tablelands level though under 2000 ft [610 m].)",8023,"Johnson, L.A.S.",,buds | flowers | fruit,,Present,sheet,,,,1975-03-29,,"Co-dominant, on level sandstone plateau, in dry sclerophyll forest of Euc. mannifera ssp. gullickii & E. sieberi, etc.",,,,,,Australia,,New South Wales,,2 km NE of Carrington Falls,2 km NE of Carrington Falls,,630.0,630.0,,,,,"34,37,,S,150,39,,E,",,,,,-34.62,150.65,,1000.0,,,,,,,,,,,,,,Angophora floribunda (Sm.) Sweet,,,,,Myrtaceae,Angophora,floribunda,,,(Sm.) Sweet,
NSW:NSW:NSW 355631,PhysicalObject,2014-04-27 15:13:00.0,NSW,NSW,PreservedSpecimen,NSW:NSW:NSW 355631,NSW 355631,Locally frequent tree 12 m high. [Bark of [A.] floribunda. LJ],8370,"Johnson, L.A.S.",,,native,Present,sheet,,,,1977-10-30,,"Plateau near fall to deep valley, sandstone. Forest with Eucalyptus sieberi.",,,,,,Australia,,New South Wales,,"Teudts Hill, 8 km SW of Bundanoon","Teudts Hill, 8 km SW of Bundanoon",,,,,,,,"34,41,,S,150,16,,E,",,,,,-34.68,150.27,,1000.0,,,,,,,,,,,,,,Angophora floribunda (Sm.) Sweet,,,,,Myrtaceae,Angophora,floribunda,,,(Sm.) Sweet,
NSW:NSW:NSW 355632,PhysicalObject,2014-04-27 15:13:00.0,NSW,NSW,PreservedSpecimen,NSW:NSW:NSW 355632,NSW 355632,"Tree, c. 5 m. Fls white with white stout petals.",1358,"Nordenstam, B.",,buds | flowers | fruit,native,Present,sheet,,,,1989-11-14,,Mountain slopes in tall Eucalyptus forest.,,,,,,Australia,,New South Wales,,23 km E of Braidwood,23 km E of Braidwood,,,,,,,,"35,33,,S,149,58,,E,",,,,,-35.55,149.97,,10000.0,,,,,,,,,,,,,,Angophora floribunda (Sm.) Sweet,,,,,Myrtaceae,Angophora,floribunda,,,(Sm.) Sweet,
NSW:NSW:NSW 355633,PhysicalObject,2014-04-27 15:13:00.0,NSW,NSW,PreservedSpecimen,NSW:NSW:NSW 355633,NSW 355633,"Distr. Forester, Narrabri",17,Unknown,,fruit,native,Present,sheet,,,,1912-02-22,,,,,,,,Australia,,New South Wales,,Bingara district (Bora),Bingara district (Bora),,,,,,,,"29,50,,S,150,34,,E,",,,,,-29.83,150.57,,10000.0,,,,,,,,,,,,,,Angophora floribunda (Sm.) Sweet,,,,,Myrtaceae,Angophora,floribunda,,,(Sm.) Sweet,
NSW:NSW:NSW 355634,PhysicalObject,2015-08-06 10:34:00.0,NSW,NSW,PreservedSpecimen,NSW:NSW:NSW 355634,NSW 355634,Rough bark Apple.,8,"de Beuzeville, W.A.W.",,fruit,native,Present,sheet,,,,1912-09-03,,,,,,,,Australia,,New South Wales,,Warialda,Warialda,,,,,,,,"29,32,,S,150,35,,E,",,,,,-29.53,150.58,,10000.0,,,,,,,,,,,,,,Angophora floribunda (Sm.) Sweet,,,,,Myrtaceae,Angophora,floribunda,,,(Sm.) Sweet,
NSW:NSW:NSW 355635,PhysicalObject,2017-05-02 12:11:00.0,NSW,NSW,PreservedSpecimen,NSW:NSW:NSW 355635,NSW 355635,"Roughbarked Angophora - 50 ft [15.2 m], 8 ft: 10 ft [2.4 m: 3 m] bole. Spreading. Seed open on tree.",2,"Swain, E.H.F.",,fruit,native,Present,sheet,,,,1911-07,,Sandy soil.,,,,,,Australia,,New South Wales,,"Gwydir River, Yagobie","Gwydir River, Yagobie",,,,,,,,"29,32,,S,150,16,,E,",,,,,-29.53,150.27,,10000.0,,,,,,,,,,,,,,Angophora floribunda (Sm.) Sweet,,,,,Myrtaceae,Angophora,floribunda,,,(Sm.) Sweet,
NSW:NSW:NSW 355636,PhysicalObject,2015-02-19 11:41:00.0,NSW,NSW,PreservedSpecimen,NSW:NSW:NSW 355636,NSW 355636,Tree to 10 m tall. Native at location. [ex NE 047102A],00381,"Mackay, D.F.",,fruit,,Present,sheet,,,,1988-03-19,,"On shallow loamy soil in shrub woodland of Callitris glaucophylla, Pimelea etc.",,,,,,Australia,,New South Wales,,"Oaky Creek Koloona Rd, 2 km E of Warialda-Bingara road.","Oaky Creek Koloona Rd, 2 km E of Warialda-Bingara road.",,380.0,380.0,,,,,"29,40,,S,150,33,,E,",,,,,-29.67,150.55,,1000.0,,,,,,,,,,,,,,Angophora floribunda (Sm.) Sweet,,,,,Myrtaceae,Angophora,floribunda,,,(Sm.) Sweet,
NSW:NSW:NSW 355637,PhysicalObject,2014-04-27 15:13:00.0,NSW,NSW,PreservedSpecimen,NSW:NSW:NSW 355637,NSW 355637,Narrow or drooping leafed Apple,,"Burrow, G.",,buds | flowers,native,Present,sheet,,,,1906-01,,,,,,,,Australia,,New South Wales,,Ph [Parish] Chapman Co [County] Harding [12 m [19.2 km] SE of Bundarra,Ph [Parish] Chapman Co [County] Harding [12 m [19.2 km] SE of Bundarra,,,,,,,,"30,18,,S,151,14,,E,",,,,,-30.3,151.23,,10000.0,,,,,,,,,,,,,,Angophora floribunda (Sm.) Sweet,,,,,Myrtaceae,Angophora,floribunda,,,(Sm.) Sweet,
NSW:NSW:NSW 355638,PhysicalObject,2014-04-27 15:13:00.0,NSW,NSW,PreservedSpecimen,NSW:NSW:NSW 355638,NSW 355638,,,"Hay, R.L.",,fruit,native,Present,sheet,,,,1903-09,,,,,,,,Australia,,New South Wales,,"Walroodah, Barraba","Walroodah, Barraba",,,,,,,,"30,23,,S,150,36,,E,",,,,,-30.38,150.6,,10000.0,,,,,,,,,,,,,,Angophora floribunda (Sm.) Sweet,,,,,Myrtaceae,Angophora,floribunda,,,(Sm.) Sweet,
NSW:NSW:NSW 355639,PhysicalObject,2015-02-04 10:02:00.0,NSW,NSW,PreservedSpecimen,NSW:NSW:NSW 355639,NSW 355639,,,"Leichhardt, F.W.L.",,flowers | fruit,native,Present,sheet,,,,,,,,,,,,Australia,,New South Wales,,Koolah Station [Coolah Homestead].,Koolah Station [Coolah Homestead].,,,,,,,,"30,12,,S,148,53,,E,",,,,,-30.2,148.88,,10000.0,,,,,,,,,,,,,,Angophora floribunda (Sm.) Sweet,,,,,Myrtaceae,Angophora,floribunda,,,(Sm.) Sweet,
NSW:NSW:NSW 355640,PhysicalObject,2015-02-19 11:41:00.0,NSW,NSW,PreservedSpecimen,NSW:NSW:NSW 355640,NSW 355640,Frequent spreading tree 14 m high. Native at location. [ex NE 046162A],00107,"Mackay, D.F.",,fruit,native,Present,sheet,,,,1987-12-06,,"On solodised solonetz, flat, in a deep creek bank, open woodland with Cassinia etc.",,,,,,Australia,,New South Wales,Pilliga East State Forest,"Delwood Road, ca. 6 km East Creaghs Road,","Delwood Road, ca. 6 km East Creaghs Road,",,,,,,,,"30,48,,S,149,36,,E,",,,,,-30.8,149.6,,10000.0,,,,,,,,,,,,,,Angophora floribunda (Sm.) Sweet,,,,,Myrtaceae,Angophora,floribunda,,,(Sm.) Sweet,
NSW:NSW:NSW 355641,PhysicalObject,2014-04-27 15:13:00.0,NSW,NSW,PreservedSpecimen,NSW:NSW:NSW 355641,NSW 355641,,,"Speers, J.",,fruit,native,Present,sheet,,,,1914-04,,,,,,,,Australia,,New South Wales,,"Moore Village, Attunga","Moore Village, Attunga",,,,,,,,"30,57,,S,150,51,,E,",,,,,-30.95,150.85,,10000.0,,,,,,,,,,,,,,Angophora floribunda (Sm.) Sweet,,,,,Myrtaceae,Angophora,floribunda,,,(Sm.) Sweet,
NSW:NSW:NSW 355642,PhysicalObject,2014-04-27 15:13:00.0,NSW,NSW,PreservedSpecimen,NSW:NSW:NSW 355642,NSW 355642,,,"Carne, W.M.",,fruit,native,Present,sheet,,,,1912-08,,Angophora intermedia (not flowering) is plentiful on the low land & stream sides but also occurs on hills particularly those of limestone.,,,,,,Australia,,New South Wales,,Tamworth.,Tamworth.,,,,,,,,"31,05,,S,150,56,,E,",,,,,-31.08,150.93,,10000.0,,,,,,,,,,,,,,Angophora floribunda (Sm.) Sweet,,,,,Myrtaceae,Angophora,floribunda,,,(Sm.) Sweet,
NSW:NSW:NSW 355643,PhysicalObject,2014-04-27 15:13:00.0,NSW,NSW,PreservedSpecimen,NSW:NSW:NSW 355643,NSW 355643,,,"Blakely, W.F.",,fruit,native,Present,sheet,,,,1927-04,,,,,,,,Australia,,New South Wales,,foot of range near Tamworth,foot of range near Tamworth,,,,,,,,"31,05,,S,150,56,,E,",,,,,-31.08,150.93,,10000.0,,,,,,,,,,,,,,Angophora floribunda (Sm.) Sweet,,,,,Myrtaceae,Angophora,floribunda,,,(Sm.) Sweet,
NSW:NSW:NSW 355644,PhysicalObject,2014-04-27 15:13:00.0,NSW,NSW,PreservedSpecimen,NSW:NSW:NSW 355644,NSW 355644,Also found in sheltered areas throughout park. Flowers cream.,,"Hosking, J.R.",,flowers | fruit,,Present,sheet,,,,1987-01-19,,From alongside animal park fence below carpark. Skeletal soil.,,,,,,Australia,,New South Wales,,"Oxley Park, Tamworth","Oxley Park, Tamworth",,520.0,520.0,,,,,"31,05,,S,150,57,,E,",,,,,-31.08,150.95,,10000.0,,,,,,,,,,,,,,Angophora floribunda (Sm.) Sweet,,,,,Myrtaceae,Angophora,floribunda,,,(Sm.) Sweet,
NSW:NSW:NSW 355645,PhysicalObject,2014-04-27 15:13:00.0,NSW,NSW,PreservedSpecimen,NSW:NSW:NSW 355645,NSW 355645,,,Unknown,,,native,Present,sheet,,,,,,,,,,,,Australia,,New South Wales,,Curlewis.,Curlewis.,,,,,,,,"31,07,,S,150,16,,E,",,,,,-31.12,150.27,,10000.0,,,,,,,,,,,,,,Angophora floribunda (Sm.) Sweet,,,,,Myrtaceae,Angophora,floribunda,,,(Sm.) Sweet,
NSW:NSW:NSW 355646,PhysicalObject,2017-11-10 12:08:00.0,NSW,NSW,PreservedSpecimen,NSW:NSW:NSW 355646,NSW 355646,"Tree ca. 45 ft [13.7 m] high, d.b.h. 3.5 ft [1.05 m], common, flowers white (when fresh) and heavily scented; deeply furrowed bark.",,"Tindale, M.D.",,buds | flowers | fruit,,Present,sheet,,,,1969-01-14,,On hillside in eucalypt woodland.,,,,,,Australia,,New South Wales,,31 mls [49.6 km] N of Murrurundi,31 mls [49.6 km] N of Murrurundi,,396.0,396.0,,,,,"31,15,,S,150,49,,E,",,,,,-31.25,150.82,,10000.0,,,,,,,,,,,,,,Angophora floribunda (Sm.) Sweet,,,,,Myrtaceae,Angophora,floribunda,,,(Sm.) Sweet,
NSW:NSW:NSW 355647,PhysicalObject,2014-04-27 15:13:00.0,NSW,NSW,PreservedSpecimen,NSW:NSW:NSW 355647,NSW 355647,"Rather straggling tree up to 60 ft [18.2 m]. Bark grey-brown, often but not always deeply furrowed. Apple. [ex Commonwealth Forestry Bureau]",R 65,"Roe, R.",,buds | flowers,native,Present,sheet,,,,1941-02-02,,Undulating granitic soil.,,,,,,Australia,,New South Wales,,30 m [48 km] S Tamworth,30 m [48 km] S Tamworth,,,,,,,,"31,36,,S,150,56,,E,",,,,,-31.6,150.93,,10000.0,,,,,,,,,,,,,,Angophora floribunda (Sm.) Sweet,,,,,Myrtaceae,Angophora,floribunda,,,(Sm.) Sweet,
NSW:NSW:NSW 355648,PhysicalObject,2018-02-05 14:36:00.0,NSW,NSW,PreservedSpecimen,NSW:NSW:NSW 355648,NSW 355648,,,"Cheel, E.",,,native,Present,sheet,,,,1926-11-19,,,,,,,,Australia,,New South Wales,,Willow Tree,Willow Tree,,,,,,,,"31,39,,S,150,44,,E,",,,,,-31.65,150.73,,10000.0,,,,,,,,,,,,,,Angophora floribunda (Sm.) Sweet,,,,,Myrtaceae,Angophora,floribunda,,,(Sm.) Sweet,
NSW:NSW:NSW 355649,PhysicalObject,2014-04-27 15:13:00.0,NSW,NSW,PreservedSpecimen,NSW:NSW:NSW 355649,NSW 355649,,,"Garden, J.",,fruit,native,Present,sheet,,,,1949-10-14,,,,,,,,Australia,,New South Wales,,Cobbora,Cobbora,,,,,,,,"32,03,,S,149,15,,E,",,,,,-32.05,149.25,,10000.0,,,,,,,,,,,,,,Angophora floribunda (Sm.) Sweet,,,,,Myrtaceae,Angophora,floribunda,,,(Sm.) Sweet,
NSW:NSW:NSW 355650,PhysicalObject,2014-04-27 15:13:00.0,NSW,NSW,PreservedSpecimen,NSW:NSW:NSW 355650,NSW 355650,,,"Maiden, J.H.",,flowers,native,Present,sheet,,,,1897-12,,,,,,,,Australia,,New South Wales,,Dubbo.,Dubbo.,,,,,,,,"32,15,,S,148,37,,E,",,,,,-32.25,148.62,,10000.0,,,,,,,,,,,,,,Angophora floribunda (Sm.) Sweet,,,,,Myrtaceae,Angophora,floribunda,,,(Sm.) Sweet,
NSW:NSW:NSW 355651,PhysicalObject,2018-06-26 13:10:00.0,NSW,NSW,PreservedSpecimen,NSW:NSW:NSW 355651,NSW 355651,Full rough-barked tree to 9 metres tall.,15,"Wilson, Peter G.",,flowers | fruit,,Present,sheet,,,,1985-01-10,,Stony river bank with Euc. camaldulensis.,,,,,,Australia,,New South Wales,,"bank of the Macquarie River, Geurie Homestead","bank of the Macquarie River, Geurie Homestead",,260.0,260.0,,,,,"32,25,,S,148,47,,E,",,,,,-32.42,148.78,,1000.0,,,,,,,,,,,,,,Angophora floribunda (Sm.) Sweet,,,,,Myrtaceae,Angophora,floribunda,,,(Sm.) Sweet,
NSW:NSW:NSW 355652,PhysicalObject,2014-04-27 15:13:00.0,NSW,NSW,PreservedSpecimen,NSW:NSW:NSW 355652,NSW 355652,An apple box. per Cowra Soil Conservation Research Station,,Unknown,,fruit,native,Present,sheet,,,,1949-10,,Growing on a river flat.,,,,,,Australia,,New South Wales,,6 miles [9.6 km] N of Mudgee,6 miles [9.6 km] N of Mudgee,,,,,,,,"32,31,,S,149,35,,E,",,,,,-32.52,149.58,,10000.0,,,,,,,,,,,,,,Angophora floribunda (Sm.) Sweet,,,,,Myrtaceae,Angophora,floribunda,,,(Sm.) Sweet,
NSW:NSW:NSW 355653,PhysicalObject,2014-04-27 15:13:00.0,NSW,NSW,PreservedSpecimen,NSW:NSW:NSW 355653,NSW 355653,,,"Maiden, J.H.",,buds | flowers,native,Present,sheet,,,,1895-01,,,,,,,,Australia,,New South Wales,,Wellington.,Wellington.,,,,,,,,"32,33,,S,148,57,,E,",,,,,-32.55,148.95,,10000.0,,,,,,,,,,,,,,Angophora floribunda (Sm.) Sweet,,,,,Myrtaceae,Angophora,floribunda,,,(Sm.) Sweet,
NSW:NSW:NSW 355654,PhysicalObject,2014-04-27 15:13:00.0,NSW,NSW,PreservedSpecimen,NSW:NSW:NSW 355654,NSW 355654,,,"Maiden, J.H.",,fruit,native,Present,sheet,,,,1896-03,,,,,,,,Australia,,New South Wales,,Buccaroo [Buckaroo] near Mudgee,Buccaroo [Buckaroo] near Mudgee,,,,,,,,"32,33,,S,149,39,,E,",,,,,-32.55,149.65,,10000.0,,,,,,,,,,,,,,Angophora floribunda (Sm.) Sweet,,,,,Myrtaceae,Angophora,floribunda,,,(Sm.) Sweet,
NSW:NSW:NSW 355655,PhysicalObject,2018-06-26 12:56:00.0,NSW,NSW,PreservedSpecimen,NSW:NSW:NSW 355655,NSW 355655,Apple,,"Boorman, J.L.",,fruit,native,Present,sheet,,,,1901-04,,,,,,,,Australia,,New South Wales,,Lue,Lue,,,,,,,,"32,40,,S,149,51,,E,",,,,,-32.67,149.85,,10000.0,,,,,,,,,,,,,,Angophora floribunda (Sm.) Sweet,,,,,Myrtaceae,Angophora,floribunda,,,(Sm.) Sweet,
NSW:NSW:NSW 355656,PhysicalObject,2018-02-05 14:36:00.0,NSW,NSW,PreservedSpecimen,NSW:NSW:NSW 355656,NSW 355656,,,"Cheel, E.",,sterile,native,Present,sheet,,,,1926-03-20,,,,,,,,Australia,,New South Wales,,Cudgegong,Cudgegong,,,,,,,,"32,48,,S,149,49,,E,",,,,,-32.8,149.82,,10000.0,,,,,,,,,,,,,,Angophora floribunda (Sm.) Sweet,,,,,Myrtaceae,Angophora,floribunda,,,(Sm.) Sweet,
NSW:NSW:NSW 355657,PhysicalObject,2017-05-29 14:45:00.0,NSW,NSW,PreservedSpecimen,NSW:NSW:NSW 355657,NSW 355657,20 ft [6 m] tree.,7037,"Story, R.",,,native,Present,sheet,,,,1960-04-27,,Fairly frequent on S. [steep] rocky slopes of steep basalt hill.,,,,,,Australia,,New South Wales,,"28 miles [44.8 km] north-northwest of Merriwa, Hunter Valley.","28 miles [44.8 km] north-northwest of Merriwa, Hunter Valley.",,,,,,,,"31,40,,S,150,19,,E,",,,,,-31.67,150.32,,10000.0,,,,,,,,,,,,,,Angophora floribunda (Sm.) Sweet,,,,,Myrtaceae,Angophora,floribunda,,,(Sm.) Sweet,
NSW:NSW:NSW 355658,PhysicalObject,2014-04-27 15:13:00.0,NSW,NSW,PreservedSpecimen,NSW:NSW:NSW 355658,NSW 355658,Appletree,5,"Macqueen, L.A.",,fruit,native,Present,sheet,,,,1913-05,,,,,,,,Australia,,New South Wales,,Murrurundi,Murrurundi,,,,,,,,"31,46,,S,150,49,,E,",,,,,-31.77,150.82,,10000.0,,,,,,,,,,,,,,Angophora floribunda (Sm.) Sweet,,,,,Myrtaceae,Angophora,floribunda,,,(Sm.) Sweet,
