id,type,modified,institutionCode,collectionCode,basisOfRecord,occurrenceID,catalogNumber,occurrenceRemarks,recordNumber,recordedBy,lifeStage,reproductiveCondition,establishmentMeans,occurrenceStatus,preparations,associatedSequences,associatedTaxa,previousIdentifications,eventDate,verbatimEventDate,habitat,eventRemarks,continent,waterBody,islandGroup,island,country,countryCode,stateProvince,county,locality,verbatimLocality,verbatimElevation,minimumElevationInMeters,maximumElevationInMeters,verbatimDepth,minimumDepthInMeters,maximumDepthInMeters,locationRemarks,verbatimCoordinates,verbatimLatitude,verbatimLongitude,verbatimCoordinateSystem,verbatimSRS,decimalLatitude,decimalLongitude,geodeticDatum,coordinateUncertaintyInMeters,coordinatePrecision,georeferencedBy,georeferencedDate,georeferenceProtocol,georeferenceSources,georeferenceVerificationStatus,georeferenceRemarks,identificationID,identifiedBy,dateIdentified,identificationRemarks,identificationQualifier,typeStatus,scientificName,kingdom,phylum,class,order,family,genus,specificEpithet,infraspecificEpithet,taxonRank,scientificNameAuthorship,nomenclaturalStatus
NSW:NSW:NSW 836,PhysicalObject,2013-10-18 11:33:00.0,NSW,NSW,PreservedSpecimen,NSW:NSW:NSW 836,NSW 836,,,"Anderson, R.H.",,fruit,native,Present,sheet,,,,1945-10-21,,,,,,,,Australia,,New South Wales,,St Ives (Tumbledown Dick Road),St Ives (Tumbledown Dick Road),,,,,,,,"33,42,,S,151,01,,E,",,,,,-33.7,151.02,,10000.0,,,,,,,,,,,,,,Angophora crassifolia (G.J.Leach) L.A.S.Johnson & K.D.Hill,,,,,Myrtaceae,Angophora,crassifolia,,,(G.J.Leach) L.A.S.Johnson & K.D.Hill,
NSW:NSW:NSW 3984,PhysicalObject,2016-11-15 11:56:00.0,NSW,NSW,PreservedSpecimen,NSW:NSW:NSW 3984,NSW 3984,"Tree 30 ft [9.1 m] high, GBH 4 ft [1.2 m], full rough bark.",NSW 3984,"Constable, E.F.",,fruit,native,Present,sheet,,,,1947-07-24,,Sandy loam over shale.,,,,,,Australia,,New South Wales,Castlereagh State Forest,Windsor.,Windsor.,,,,,,,,"33,37,,S,150,49,,E,",,,,,-33.62,150.82,,10000.0,,,,,,,,,,,,,,Angophora bakeri E.C.Hall,,,,,Myrtaceae,Angophora,bakeri,,,E.C.Hall,
NSW:NSW:NSW 4005,PhysicalObject,2016-11-15 11:56:00.0,NSW,NSW,PreservedSpecimen,NSW:NSW:NSW 4005,NSW 4005,,NSW 4005,"Constable, E.F.",,fruit,native,Present,sheet,,,,1947-05-16,,,,,,,,Australia,,New South Wales,,"Coxs Road, Roseberry","Coxs Road, Roseberry",,,,,,,,"28,29,,S,152,55,,E,",,,,,-28.48,152.92,,10000.0,,,,,,,,,,,,,,Angophora subvelutina F.Muell.,,,,,Myrtaceae,Angophora,subvelutina,,,F.Muell.,
NSW:NSW:NSW 334608,PhysicalObject,2019-03-29 14:17:00.0,NSW,NSW,PreservedSpecimen,NSW:NSW:NSW 334608,NSW 334608,"End of spur: 32.46'08"" / 151.11'30"", [grid ref] 310730. Saddle: 32.46'08"" / 151.12'15"" [grid ref] 316730].",,"Tame, T.M.",,fruit,native,Present,sheet,,,,,,,,,,,,Australia,,New South Wales,,[c. 12 km E of Broke],[c. 12 km E of Broke],,,,,,,,"32,46,,S,151,13,,E,",,,,,-32.77,151.22,,1000.0,,,,,,,,,"Hill, K.D.",1995-11,,,,Angophora euryphylla (L.A.S.Johnson ex G.J.Leach) L.A.S.Johnson & K.D.Hill,,,,,Myrtaceae,Angophora,euryphylla,,,(L.A.S.Johnson ex G.J.Leach) L.A.S.Johnson & K.D.Hill,
NSW:NSW:NSW 16381,PhysicalObject,2019-03-29 10:27:00.0,NSW,NSW,PreservedSpecimen,NSW:NSW:NSW 16381,NSW 16381,"Tree 50-60 ft [15.2-18.2 m]. Leaves narrow, bark rough.",,"Johnson, L.A.S.",,fruit | sterile,,Present,sheet,,,,1950-08-15,,"Sandstone, near creek.",,,,,,Australia,,New South Wales,,7 miles [11.2 km] N of Ulan (1/2 mile [0.8 km] E of road),7 miles [11.2 km] N of Ulan (1/2 mile [0.8 km] E of road),,366.0,366.0,,,,,"32,11,,S,149,43,,E,",,,,,-32.18,149.72,,10000.0,,,,,,,,,,,,,,Angophora jungens,,,,,Myrtaceae,Angophora,jungens,,,,
NSW:NSW:NSW 16424,PhysicalObject,2019-03-29 10:27:00.0,NSW,NSW,PreservedSpecimen,NSW:NSW:NSW 16424,NSW 16424,Angophora from stump. See also specimen A. aff. bakeri. These & all intergrades occur.,,"Johnson, L.A.S.",,sterile,,Present,sheet,,,,1950-08-18,,Sandstone.,,,,,,Australia,,New South Wales,,Boomley - Caratel,Boomley - Caratel,,442.0,442.0,,,,,"32,02,,S,149,06,,E,",,,,,-32.03,149.1,,25000.0,,,,,,,,,,,,,,Angophora jungens,,,,,Myrtaceae,Angophora,jungens,,,,
NSW:NSW:NSW 16426,PhysicalObject,2019-03-29 10:27:00.0,NSW,NSW,PreservedSpecimen,NSW:NSW:NSW 16426,NSW 16426,Angophora juveniles from stump. These and broader forms occur together on the sandstone ridges here.,,"Johnson, L.A.S.",,sterile,,Present,sheet,,,,1950-08-18,,Sandstone.,,,,,,Australia,,New South Wales,,Boomley - Caratel,Boomley - Caratel,,442.0,442.0,,,,,"32,02,,S,149,06,,E,",,,,,-32.03,149.1,,25000.0,,,,,,,,,,,,,,Angophora jungens,,,,,Myrtaceae,Angophora,jungens,,,,
NSW:NSW:NSW 48293,PhysicalObject,2019-03-29 14:17:00.0,NSW,NSW,PreservedSpecimen,NSW:NSW:NSW 48293,NSW 48293,Trees to 50 ft [15.1 m]. Smooth pinkish bark.,,"Johnson, L.A.S.",,fruit | sterile,,Present,sheet,,,,1959-09-28,,"Locally co-dominant on sandstone hillsides with Eucalyptus sparsifolia, E. eximia, E. gummifera. Alt 1200 ft.",,,,,,Australia,,New South Wales,,"South of Putty, at 55 m [88.6 km] from Windsor","South of Putty, at 55 m [88.6 km] from Windsor",,366.0,366.0,,,,,"33,12,,S,150,41,,E,",,,,,-33.2,150.68,,10000.0,,,,,,,,,,,,,,Angophora euryphylla (L.A.S.Johnson ex G.J.Leach) L.A.S.Johnson & K.D.Hill,,,,,Myrtaceae,Angophora,euryphylla,,,(L.A.S.Johnson ex G.J.Leach) L.A.S.Johnson & K.D.Hill,
NSW:NSW:NSW 127674,PhysicalObject,2019-03-29 14:17:00.0,NSW,NSW,PreservedSpecimen,NSW:NSW:NSW 127674,NSW 127674,Trees to 18 m.,,"Johnson, L.A.S.",,flowers | fruit,,Present,sheet,,,,1965-11-14,,Co-dominant with Eucalyptus punctata & E. oblonga in dry sclerophyll forest on ridge. Alt. 1400 ft.,,,,,,Australia,,New South Wales,,"1 mile [1.6 km] north of Gibb's Long Swamp, north-northwest of Putty","1 mile [1.6 km] north of Gibb's Long Swamp, north-northwest of Putty",,426.0,426.0,,,,,"32,52,,S,150,39,,E,",,,,,-32.87,150.65,,10000.0,,,,,,,,,,,,,,Angophora euryphylla (L.A.S.Johnson ex G.J.Leach) L.A.S.Johnson & K.D.Hill,,,,,Myrtaceae,Angophora,euryphylla,,,(L.A.S.Johnson ex G.J.Leach) L.A.S.Johnson & K.D.Hill,
NSW:NSW:NSW 143442,PhysicalObject,2019-03-29 10:27:00.0,NSW,NSW,PreservedSpecimen,NSW:NSW:NSW 143442,NSW 143442,"Small tree about 6"" [0.15 m] diam.",,"Garden, J.",,fruit,native,Present,sheet,,,,1949-10-16,,Almost a pure stand on a small area on sandstone hill in scrub.,,,,,,Australia,,New South Wales,,Cobbora,Cobbora,,,,,,,,"32,03,,S,149,15,,E,",,,,,-32.05,149.25,,10000.0,,,,,,,,,,,,,,Angophora jungens,,,,,Myrtaceae,Angophora,jungens,,,,
NSW:NSW:NSW 143541,PhysicalObject,2019-03-06 11:43:00.0,NSW,NSW,PreservedSpecimen,NSW:NSW:NSW 143541,NSW 143541,,,"Clarke, H.D.",,fruit,native,Present,sheet,,,,1895-11,,,,,,,,Australia,,New South Wales,,Georges River.,Georges River.,,,,,,,,"34,03,,S,151,03,,E,",,,,,-34.05,151.05,,10000.0,,,,,,,,,,,,,,Angophora costata (Gaertn.) Britten,,,,,Myrtaceae,Angophora,costata,,,(Gaertn.) Britten,
NSW:NSW:NSW 143545,PhysicalObject,2019-01-14 17:09:00.0,NSW,NSW,PreservedSpecimen,NSW:NSW:NSW 143545,NSW 143545,,5428,"Morrison, A.",,fruit,native,Present,sheet,,,,1896-10-17,,,,,,,,Australia,,New South Wales,[Royal] National Park,Sydney.,Sydney.,,,,,,,,"34,08,,S,151,04,,E,",,,,,-34.13,151.07,,10000.0,,,,,,,,,,,,,,Angophora costata (Gaertn.) Britten,,,,,Myrtaceae,Angophora,costata,,,(Gaertn.) Britten,
NSW:NSW:NSW 143577,PhysicalObject,2019-04-23 13:01:00.0,NSW,NSW,PreservedSpecimen,NSW:NSW:NSW 143577,NSW 143577,[Probably part of a variable population of A. bakeri [crassifolia] x hispida. - D.F. Blaxell],,"Blakely, W.F.",,,native,Present,sheet,,,,1936-07-18,,,,,,,,Australia,,New South Wales,,1 mile [1.61 km] SE of Killara Railway Station,1 mile [1.61 km] SE of Killara Railway Station,,,,,,,,"33,47,,S,151,10,,E,",,,,,-33.78,151.17,,10000.0,,,,,,,,,,,,,,Angophora crassifolia (G.J.Leach) L.A.S.Johnson & K.D.Hill,,,,,Myrtaceae,Angophora,crassifolia,,,(G.J.Leach) L.A.S.Johnson & K.D.Hill,
NSW:NSW:NSW 143616,PhysicalObject,2019-03-29 14:17:00.0,NSW,NSW,PreservedSpecimen,NSW:NSW:NSW 143616,NSW 143616,"Locally frequent. Smooth, pink-barked tree to 70ft [21.3 m]. Typical in habit but broad leaved.",,"Johnson, L.A.S.",,,,Present,sheet,,,,1957-05-19,,Uniform here. In a belt on sandstone slopes with Eucalyptus eximia. c. 1000'.,,,,,,Australia,,New South Wales,,W of Howe's Mtn (on road N of Howe's Valley),W of Howe's Mtn (on road N of Howe's Valley),,305.0,305.0,,,,,"32,49,,S,150,57,,E,",,,,,-32.82,150.95,,10000.0,,,,,,,,,,,,,,Angophora euryphylla (L.A.S.Johnson ex G.J.Leach) L.A.S.Johnson & K.D.Hill,,,,,Myrtaceae,Angophora,euryphylla,,,(L.A.S.Johnson ex G.J.Leach) L.A.S.Johnson & K.D.Hill,
NSW:NSW:NSW 143617,PhysicalObject,2019-03-29 14:17:00.0,NSW,NSW,PreservedSpecimen,NSW:NSW:NSW 143617,NSW 143617,"Common. Height usually about 40' [21.2 m]. Cinnamon-coloured bark. Leaves from several trees, some from coppice shoots.",6622,"Story, R.",,fruit,native,Present,sheet,,,,1959-09-01,,On N facing slope of side valley.,,,,,,Australia,,New South Wales,,Wollombi,Wollombi,,,,,,,,"32,56,,S,151,09,,E,",,,,,-32.93,151.15,,10000.0,,,,,,,,,,,,,,Angophora euryphylla (L.A.S.Johnson ex G.J.Leach) L.A.S.Johnson & K.D.Hill,,,,,Myrtaceae,Angophora,euryphylla,,,(L.A.S.Johnson ex G.J.Leach) L.A.S.Johnson & K.D.Hill,
NSW:NSW:NSW 143618,PhysicalObject,2019-03-29 14:17:00.0,NSW,NSW,PreservedSpecimen,NSW:NSW:NSW 143618,NSW 143618,"Common, smooth pink barked, gnarled tree to 50 ft [15.2 m]. All trees here of this form.",,"Johnson, L.A.S.",,fruit,,Present,sheet,,,,1959-11-24,,"On steep shaly sandstone hillside, N aspect. With Eucalyptus puncatata, E. agglomerata. Alt. 1000 ft.",,,,,,Australia,,New South Wales,,"Near head of Wattagan [Watagan] Ck, c. 6 m [9.7 km] E of Wattagan [Watagan] (i.e. c. 15 m [24.2 km] direct S of Cessnock)","Near head of Wattagan [Watagan] Ck, c. 6 m [9.7 km] E of Wattagan [Watagan] (i.e. c. 15 m [24.2 km] direct S of Cessnock)",,304.0,304.0,,,,,"33,03,,S,151,20,,E,",,,,,-33.05,151.33,,10000.0,,,,,,,,,,,,,,Angophora euryphylla (L.A.S.Johnson ex G.J.Leach) L.A.S.Johnson & K.D.Hill,,,,,Myrtaceae,Angophora,euryphylla,,,(L.A.S.Johnson ex G.J.Leach) L.A.S.Johnson & K.D.Hill,
NSW:NSW:NSW 143619,PhysicalObject,2019-03-29 14:17:00.0,NSW,NSW,PreservedSpecimen,NSW:NSW:NSW 143619,NSW 143619,Pink-barked tree to 25 m. Broad-leaved. [Sucker growth from large tree.],,"Johnson, L.A.S.",,fruit | sterile,,Present,sheet,,,,1965-10-17,,"Head of gully towards Mangrove Ck. Tall forest (semi-wet sclerophyll) with Eucalyptus deanei, E. punctata, E. piperita.",,,,,,Australia,,New South Wales,,"Sampson's Pass, Judge Dowling Range, Old North Road (i.e. 8 miles [12.9 km] west-northwest of Kulnura)","Sampson's Pass, Judge Dowling Range, Old North Road (i.e. 8 miles [12.9 km] west-northwest of Kulnura)",,225.0,225.0,,,,,"33,08,,S,151,09,,E,",,,,,-33.13,151.15,,10000.0,,,,,,,,,,,,,,Angophora euryphylla (L.A.S.Johnson ex G.J.Leach) L.A.S.Johnson & K.D.Hill,,,,,Myrtaceae,Angophora,euryphylla,,,(L.A.S.Johnson ex G.J.Leach) L.A.S.Johnson & K.D.Hill,
NSW:NSW:NSW 199299,PhysicalObject,2019-03-29 14:17:00.0,NSW,NSW,PreservedSpecimen,NSW:NSW:NSW 199299,NSW 199299,"Frequent twisted tree to 12 m high. Smooth spotted grey bark, much reversion growth in canopy.",2784,"Hill, K.D.",,fruit,,Present,sheet,,,,1988-05-03,,"Tall dry sclerophyll woodland on ridge crest with Eucalyptus beyeri, E. punctata, E. fergusonii, E. prominula, Corymbia eximia, and Persoonia, Pultenaea, Bossiaea under. Shallow sandy soil on sandstone.",,,,,,Australia,,New South Wales,Yengo National Park,"Old Convict Road, 5.5 km due W of Paynes Crossing bridge,","Old Convict Road, 5.5 km due W of Paynes Crossing bridge,",,200.0,200.0,,,,,"32,52,,S,151,01,,E,",,,,,-32.87,151.02,,1000.0,,,,,,,,,,,,,,Angophora euryphylla (L.A.S.Johnson ex G.J.Leach) L.A.S.Johnson & K.D.Hill,,,,,Myrtaceae,Angophora,euryphylla,,,(L.A.S.Johnson ex G.J.Leach) L.A.S.Johnson & K.D.Hill,
NSW:NSW:NSW 199916,PhysicalObject,2018-11-28 12:01:00.0,NSW,NSW,PreservedSpecimen,NSW:NSW:NSW 199916,NSW 199916,Tree to 70 feet [21.3 m]. Bark rough. [May be cited as computerised collection number AQ 404767.],1217,"Pedley, L.",,flowers | fruit,native,Present,sheet,,,,1963-02-05,,,,,,,,Australia,,Queensland,,Maidenhead,Maidenhead,,,,,,,,"29,10,,S,151,22,,E,",,,,,-29.17,151.37,,10000.0,,,,,,,,,,,,,,Angophora floribunda -- subvelutina,,,,,Myrtaceae,Angophora,floribunda -- subvelutina,,,,
NSW:NSW:NSW 205757,PhysicalObject,2019-03-29 10:29:00.0,NSW,NSW,PreservedSpecimen,NSW:NSW:NSW 205757,NSW 205757,"Locally frequent. Tree to 20 m high. Thick, fissured, shortly fibrous bark, white flowers.",1328,"Hill, K.D.",,buds | flowers,native,Present,sheet,,,,1986-01-01,,"Dry sclerophyll forest, Corymbia tessellaris, C. polycarpa, Eucalyptus melanophloia, Livistona, Macrozamia moorei, E. tereticornis. Broad, flat floodplain through sandstone. Grey sandy alluvium on creek levee.",,,,,,Australia,,Queensland,,Carnarvon Gorge campground,Carnarvon Gorge campground,,,,,,,,"25,03,,S,148,14,,E,",,,,,-25.05,148.23,,10000.0,,,,,,,,,,,,,,Angophora expansa L.A.S.Johnson & K.D.Hill,,,,,Myrtaceae,Angophora,expansa,,,L.A.S.Johnson & K.D.Hill,
NSW:NSW:NSW 249396,PhysicalObject,2019-03-29 14:17:00.0,NSW,NSW,PreservedSpecimen,NSW:NSW:NSW 249396,NSW 249396,"Locally abundant. Tree 8-10 m high with smooth, pinkish-grey bark.",15438,"Coveny, R.G.",,fruit,native,Present,sheet,,,,1991-08-08,,"Dry sclerophyll forest with Eucalyptus punctata, E. eximia, E. gummifera, E. squamosa, E. sparsifolia, Angophora euryphylla, Persoonia levis, P. linearis, Grevillea sphacelata, Leptospermum trinervium, etc. on exposed ridge. Sandstone.",,,,,,Australia,,New South Wales,,"Staircase Hill, quarry on E side of road at crest of hill near entrance to ""High Wollemi"" property, 77 km N of Wilberforce on the Windsor - Singleton road","Staircase Hill, quarry on E side of road at crest of hill near entrance to ""High Wollemi"" property, 77 km N of Wilberforce on the Windsor - Singleton road",,,,,,,,"33,03,,S,150,41,,E,",,,,,-33.05,150.68,,,,,,,,,,,"Hill, K.D.",1992-01,,,,Angophora euryphylla (L.A.S.Johnson ex G.J.Leach) L.A.S.Johnson & K.D.Hill,,,,,Myrtaceae,Angophora,euryphylla,,,(L.A.S.Johnson ex G.J.Leach) L.A.S.Johnson & K.D.Hill,
NSW:NSW:NSW 253252,PhysicalObject,2019-03-29 15:01:00.0,NSW,NSW,PreservedSpecimen,NSW:NSW:NSW 253252,NSW 253252,"Small tree. Bark rough persistent on all trunk, decorticating in long scales. Fibrous, light grey with underbark reddish. Leaves same green both sides. Fruit dry.",98,"D'Orazio, R.",,fruit,native,Present,sheet,,,,1992-02-23,,Along road.,,,,,,Australia,,New South Wales,,"Armstrong street, Seaforth.","Armstrong street, Seaforth.",,,,,,,,"33,45,,S,151,15,,E,",,,,,-33.75,151.25,,,,,,,,,,,,,,,,Angophora bakeri E.C.Hall,,,,,Myrtaceae,Angophora,bakeri,,,E.C.Hall,
NSW:NSW:NSW 261578,PhysicalObject,2019-03-29 14:17:00.0,NSW,NSW,PreservedSpecimen,NSW:NSW:NSW 261578,NSW 261578,Medium tree with smooth bark. [ex Herb. T.M. Tame],3477,"Tame, T.M.",,fruit,native,Present,sheet,,,,1992-09-27,,Sandstone ridgetop. Rocky skeletal sandy soil.,,,,,,Australia,,New South Wales,,Broken Back Range,Broken Back Range,,,,,,,,"32,46,,S,151,13,,E,",,,,,-32.77,151.22,,10000.0,,,,,,,,,,,,,,Angophora euryphylla (L.A.S.Johnson ex G.J.Leach) L.A.S.Johnson & K.D.Hill,,,,,Myrtaceae,Angophora,euryphylla,,,(L.A.S.Johnson ex G.J.Leach) L.A.S.Johnson & K.D.Hill,
NSW:NSW:NSW 269151,PhysicalObject,2019-03-29 14:17:00.0,NSW,NSW,PreservedSpecimen,NSW:NSW:NSW 269151,NSW 269151,"Locally occasional. Tree, 9-10 m high.",504,"Wiecek, B.M.",,fruit,,Present,sheet,,,,1993-04-05,,"Windswept ridgetop with Angophora costata, and numerous sclerophyllous shrubs in the understorey.",,,,,,Australia,,New South Wales,,"Broken Back Range, track W of Broken Back Trig out to Mans Head Point, saddle S side of ridge","Broken Back Range, track W of Broken Back Trig out to Mans Head Point, saddle S side of ridge",,500.0,500.0,,,,,"32,46,,S,151,12,,E,",,,,,-32.77,151.2,,10000.0,,,,,,,,,"Wiecek, B.M.",1993-05-07,,,,Angophora euryphylla (L.A.S.Johnson ex G.J.Leach) L.A.S.Johnson & K.D.Hill,,,,,Myrtaceae,Angophora,euryphylla,,,(L.A.S.Johnson ex G.J.Leach) L.A.S.Johnson & K.D.Hill,
NSW:NSW:NSW 355420,PhysicalObject,2019-01-25 13:05:00.0,NSW,NSW,PreservedSpecimen,NSW:NSW:NSW 355420,NSW 355420,"Common shrub c. 1.5 m high; foliage glaucous; fls white, fragrance rather sour. [Distributed by the Dept of Botany University of California, Davis]",19120,"Webster, G.L.",,buds | flowers,,Present,sheet,,,,1973-12-01,,"Eucalypt scrub woodland, alt. 450 ft [137 m].",,,,,,Australia,,New South Wales,Royal National Park,"On Warumbul Road c. 1.5 ml [2.4 km] southeast of Audley,","On Warumbul Road c. 1.5 ml [2.4 km] southeast of Audley,",,137.0,137.0,,,,,"34,05,,S,151,05,,E,",,,,,-34.08,151.08,,10000.0,,,,,,,,,,,,,,Angophora hispida (Sm.) Blaxell,,,,,Myrtaceae,Angophora,hispida,,,(Sm.) Blaxell,
NSW:NSW:NSW 355421,PhysicalObject,2019-01-15 16:51:00.0,NSW,NSW,PreservedSpecimen,NSW:NSW:NSW 355421,NSW 355421,"13-5-5 [ex The Musson Herbarium, Hawkesbury Agricultural College, Richmond]",,"Carne, W.M.",,,native,Present,sheet,,,,1905-05-13,,,,,,,,Australia,,New South Wales,[Royal] National Park,,,,,,,,,,"34,08,,S,151,04,,E,",,,,,-34.13,151.07,,10000.0,,,,,,,,,,,,,,Angophora hispida (Sm.) Blaxell,,,,,Myrtaceae,Angophora,hispida,,,(Sm.) Blaxell,
NSW:NSW:NSW 355498,PhysicalObject,2019-01-14 17:10:00.0,NSW,NSW,PreservedSpecimen,NSW:NSW:NSW 355498,NSW 355498,"Tree - 30 feet [9.1 m] high, with fruit & seedlings and young growth, and a smoth reddish bark.",679,"Melville, R.",,fruit,native,Present,sheet,,,,1952-08-30,,In Angophora-Eucalyptus forest. On edge of steep scarp & on rock ledges of Hawkesbury sandstone.,,,,,,Australia,,New South Wales,,Peats Ferry Ridge [? Bridge],Peats Ferry Ridge [? Bridge],,,,,,,,"33,35,,S,151,14,,E,",,,,,-33.58,151.23,,10000.0,,,,,,,,,,,,,,Angophora costata (Gaertn.) Britten,,,,,Myrtaceae,Angophora,costata,,,(Gaertn.) Britten,
NSW:NSW:NSW 355502,PhysicalObject,2019-02-11 12:16:00.0,NSW,NSW,PreservedSpecimen,NSW:NSW:NSW 355502,NSW 355502,"[ex Museum of Applied Arts and Sciences, Sydney]",,"Small, B.E.",,,native,Present,sheet,,,,1966-10,,,,,,,,Australia,,New South Wales,,"Cemetry [Cemetery] Road, Castle Hill","Cemetry [Cemetery] Road, Castle Hill",,,,,,,,"33,45,,S,150,59,,E,",,,,,-33.75,150.98,,10000.0,,,,,,,,,,,,,,Angophora costata (Gaertn.) Britten,,,,,Myrtaceae,Angophora,costata,,,(Gaertn.) Britten,
NSW:NSW:NSW 355580,PhysicalObject,2019-02-11 12:16:00.0,NSW,NSW,PreservedSpecimen,NSW:NSW:NSW 355580,NSW 355580,"[ex Museum of Applied Arts and Sciences, Sydney]",,"Small, B.E.",,fruit,native,Present,sheet,,,,1966-11,,,,,,,,Australia,,New South Wales,,"creek off Showground Road, Castle Hill","creek off Showground Road, Castle Hill",,,,,,,,"33,45,,S,150,59,,E,",,,,,-33.75,150.98,,10000.0,,,,,,,,,,,,,,Angophora floribunda (Sm.) Sweet,,,,,Myrtaceae,Angophora,floribunda,,,(Sm.) Sweet,
NSW:NSW:NSW 355698,PhysicalObject,2019-01-14 17:11:00.0,NSW,NSW,PreservedSpecimen,NSW:NSW:NSW 355698,NSW 355698,"Isolated tree, spreading habit ca 50 feet [15.2 m]. [Collected under the auspices of the Maud Gibson Trust of the Melbourne Botanic Gardens and National Herbarium.]",2779,"Melville, R.",,buds,native,Present,sheet,,,,1953-01-09,,In grass paddock.,,,,,,Australia,,Victoria,,"Mallacoota, towards Bastion Point, Gippsland","Mallacoota, towards Bastion Point, Gippsland",,,,,,,,"37,34,,S,149,45,,E,",,,,,-37.57,149.75,,10000.0,,,,,,,,,,,,,,Angophora floribunda (Sm.) Sweet,,,,,Myrtaceae,Angophora,floribunda,,,(Sm.) Sweet,
NSW:NSW:NSW 355702,PhysicalObject,2019-04-23 13:01:00.0,NSW,NSW,PreservedSpecimen,NSW:NSW:NSW 355702,NSW 355702,"Smooth bark, pinkish, willowy, branches. Some large and strikingly beautiful trees.",2315,"McKie, E.N.",,fruit,native,Present,sheet,,,,1939-11-15,,Barren sandy soil - sandstone rocks.,,,,,,Australia,,New South Wales,,from outskirts of Warialda,from outskirts of Warialda,,,,,,,,"29,32,,S,150,35,,E,",,,,,-29.53,150.58,,10000.0,,,,,,,,,,,,,,Angophora leiocarpa (L.A.S.Johnson ex G.J.Leach) K.R.Thiele & Ladiges,,,,,Myrtaceae,Angophora,leiocarpa,,,(L.A.S.Johnson ex G.J.Leach) K.R.Thiele & Ladiges,
NSW:NSW:NSW 355770,PhysicalObject,2019-01-14 17:09:00.0,NSW,NSW,PreservedSpecimen,NSW:NSW:NSW 355770,NSW 355770,"Tree - 50 feet [15.2 m] high, branches very brittle, tinged red, trunk bark gum-like, flushed pink. [ex Herbario Kewensi]",3653,"Melville, R.",,fruit,native,Present,sheet,,,,1953-04-06,,In roadside remnant of Eucalypt forest with Eucalyptus [Corymbia] tessellaris.,,,,,,Australia,,Queensland,,about 10 miles [16.1 km] south of Ipswich,about 10 miles [16.1 km] south of Ipswich,,,,,,,,"27,47,,S,152,47,,E,",,,,,-27.78,152.78,,10000.0,,,,,,,,,,,,,,Angophora leiocarpa (L.A.S.Johnson ex G.J.Leach) K.R.Thiele & Ladiges,,,,,Myrtaceae,Angophora,leiocarpa,,,(L.A.S.Johnson ex G.J.Leach) K.R.Thiele & Ladiges,
NSW:NSW:NSW 355777,PhysicalObject,2019-01-14 17:10:00.0,NSW,NSW,PreservedSpecimen,NSW:NSW:NSW 355777,NSW 355777,"CULT. Seedlings, seed sent from Herb. Sydney for carp clloection q.v..",,Unknown,,sterile,native,Present,sheet,,,,1954-09-14,,,,,,,,England,,,,"CULTIVATED in Australian Pits, Kew","CULTIVATED in Australian Pits, Kew",,,,,,,,,,,,,,,,,,,,,,,,,,,,,,Angophora costata (Gaertn.) Britten,,,,,Myrtaceae,Angophora,costata,,,(Gaertn.) Britten,
NSW:NSW:NSW 355779,PhysicalObject,2019-07-04 13:52:00.0,NSW,NSW,PreservedSpecimen,NSW:NSW:NSW 355779,NSW 355779,"CULT. Open-, high-headed, round-spreading tree, c. 35' [10.6 m] high & 30' [9.1 m] across; trunk free to 6' [1.8 m], colourful, a variable glaucous-gray to rich buff brown, pinkish; branches ascending- spreading, smaller arching; leaves terminal, dark glossy-olive-green, leathery; flowering profuse; petals white, abruptly reflexed; filaments white. [LASCA Ac. # 54-S-1694]",5302,"Griffiths, A.",,flowers | fruit,native,Present,sheet,,,,1967-05-31,,,,,,,,United States,,California,,"CULTIVATED - K-10-SW, Golden Gate Park, San Francisco.","CULTIVATED - K-10-SW, Golden Gate Park, San Francisco.",,,,,,,,,,,,,,,,,,,,,,,,,,,,,,Angophora costata (Gaertn.) Britten,,,,,Myrtaceae,Angophora,costata,,,(Gaertn.) Britten,
NSW:NSW:NSW 355807,PhysicalObject,2019-03-29 10:29:00.0,NSW,NSW,PreservedSpecimen,NSW:NSW:NSW 355807,NSW 355807,"Tree to 10 m high, full thick shortly fibrous bark. A - seedling from under plant.",1193,"Hill, K.D.",,fruit,native,Present,sheet,,,,1984-08-22,,"Occasional in open forest with Eucalyptus tereticornis, Corymbia polycarpa, C. tessellaris on heavy alluvium in flat low area.",,,,,,Australia,,Queensland,,75.3 km W of Springsure on Tambo rd,75.3 km W of Springsure on Tambo rd,,,,,,,,"24,19,,S,147,30,,E,",,,,,-24.32,147.5,,1000.0,,,,,,,,,,,,,,Angophora expansa L.A.S.Johnson & K.D.Hill,,,,,Myrtaceae,Angophora,expansa,,,L.A.S.Johnson & K.D.Hill,
NSW:NSW:NSW 355808,PhysicalObject,2019-03-29 10:29:00.0,NSW,NSW,PreservedSpecimen,NSW:NSW:NSW 355808,NSW 355808,"Tree to 10 m high, full thick shortly fibrous bark. A - seedling from under plant.",1193 A,"Hill, K.D.",,sterile,native,Present,sheet,,,,1984-08-22,,"Occasional in open forest with Eucalyptus tereticornis, Corymbia polycarpa, C. tessellaris on heavy alluvium in flat low area.",,,,,,Australia,,Queensland,,75.3 km W of Springsure on Tambo rd,75.3 km W of Springsure on Tambo rd,,,,,,,,"24,19,,S,147,30,,E,",,,,,-24.32,147.5,,1000.0,,,,,,,,,,,,,,Angophora expansa L.A.S.Johnson & K.D.Hill,,,,,Myrtaceae,Angophora,expansa,,,L.A.S.Johnson & K.D.Hill,
NSW:NSW:NSW 355809,PhysicalObject,2019-03-29 10:29:00.0,NSW,NSW,PreservedSpecimen,NSW:NSW:NSW 355809,NSW 355809,"Frequent trees to 12 m high. This broad-leaved race occurs only on the Tableland, passing into a normal narrower form on creeks and flats off the basalt at lower altitudes.",8600,"Johnson, L.A.S.",,,native,Present,sheet,,,,1981-04-27,,"No Angophora subvelutina here. On basalt plateau, in woodland with Eucalyptus tereticornis, E. aff. laevopinea, E. major.",,,,,,Australia,,Queensland,,"west of Consuelo Tableland, at extreme head of Carnarvon Creek","west of Consuelo Tableland, at extreme head of Carnarvon Creek",,,,,,,,"24,55,,S,148,00,,E,",,,,,-24.92,148.0,,10000.0,,,,,,,,,,,,,,Angophora expansa L.A.S.Johnson & K.D.Hill,,,,,Myrtaceae,Angophora,expansa,,,L.A.S.Johnson & K.D.Hill,
NSW:NSW:NSW 355810,PhysicalObject,2019-03-29 10:29:00.0,NSW,NSW,PreservedSpecimen,NSW:NSW:NSW 355810,NSW 355810,"Tree to 20 m high, full fibrous bark. A juveniles from different plant.",1204,"Hill, K.D.",,fruit | sterile,native,Present,sheet,,,,1984-08-23,,Locally frequent in grassy forest on alluvial sandy loam on creek levee in rough gorge country.,,,,,,Australia,,Queensland,,30.1 km S of Carnarvon Ck on Rolleston - Injune rd,30.1 km S of Carnarvon Ck on Rolleston - Injune rd,,,,,,,,"25,11,,S,148,34,,E,",,,,,-25.18,148.57,,1000.0,,,,,,,,,,,,,,Angophora expansa L.A.S.Johnson & K.D.Hill,,,,,Myrtaceae,Angophora,expansa,,,L.A.S.Johnson & K.D.Hill,
NSW:NSW:NSW 355917,PhysicalObject,2019-03-29 14:17:00.0,NSW,NSW,PreservedSpecimen,NSW:NSW:NSW 355917,NSW 355917,Common tree to 20 m.,1199,"Campbell, J.",,fruit,native,Present,sheet,,,,1970-07-26,,"On stony steep hillside. In dry sclerophyll forest of Eucalyptus eximia, Agophora costata (normal) & A. bakeri.",,,,,,Australia,,New South Wales,,"Old Convict Road, 20.1 km E of Howes Valley. Near Mt Murwin.","Old Convict Road, 20.1 km E of Howes Valley. Near Mt Murwin.",,,,,,,,"32,48,,S,150,55,,E,",,,,,-32.8,150.92,,10000.0,,,,,,,,,,,,,,Angophora euryphylla (L.A.S.Johnson ex G.J.Leach) L.A.S.Johnson & K.D.Hill,,,,,Myrtaceae,Angophora,euryphylla,,,(L.A.S.Johnson ex G.J.Leach) L.A.S.Johnson & K.D.Hill,
