NSW:NSW:NSW 356096,PhysicalObject,2017-11-10 12:08:00.0,NSW,NSW,PreservedSpecimen,NSW:NSW:NSW 356096,NSW 356096,"Tree 25 ft [7.6 m] high, d.b.h. 9"" [22.5 cm], deeply furrowed ironbark.",,"Tindale, M.D.",,buds | flowers,native,Present,sheet,,,,1969-01-13,,"On grassy moist hillside, with eucalypts and Acacia filicifolia.",,,,,,Australia,,New South Wales,,3 mls [4.8 km] S of Tenterfield on New England Highway,3 mls [4.8 km] S of Tenterfield on New England Highway,,,,,,,,"29,06,,S,152,00,,E,",,,,,-29.1,152.0,,10000.0,,,,,,,,,,,,,,Angophora subvelutina F.Muell.,,,,,Myrtaceae,Angophora,subvelutina,,,F.Muell.,
NSW:NSW:NSW 356097,PhysicalObject,2013-01-24 14:41:00.0,NSW,NSW,PreservedSpecimen,NSW:NSW:NSW 356097,NSW 356097,,,"Maiden, J.H.",,buds,native,Present,sheet,,,,1898-12,,,,,,,,Australia,,New South Wales,,Tenterfield to Sandy Flat.,Tenterfield to Sandy Flat.,,,,,,,,"29,10,,S,152,01,,E,",,,,,-29.17,152.02,,25000.0,,,,,,,,,,,,,,Angophora subvelutina F.Muell.,,,,,Myrtaceae,Angophora,subvelutina,,,F.Muell.,
NSW:NSW:NSW 356098,PhysicalObject,2017-05-29 14:45:00.0,NSW,NSW,PreservedSpecimen,NSW:NSW:NSW 356098,NSW 356098,20 ft [6 m] spreading tree.,7040,"Story, R.",,fruit,native,Present,sheet,,,,1959-12-06,,Occasional on basalt hills and partly cleared Eucalypt woodland.,,,,,,Australia,,New South Wales,,"27 miles [43.2 km] NW of Merriwa, Hunter Valley","27 miles [43.2 km] NW of Merriwa, Hunter Valley",,,,,,,,"32,02,,S,150,00,,E,",,,,,-32.03,150.0,,10000.0,,,,,,,,,,,,,,Angophora subvelutina F.Muell.,,,,,Myrtaceae,Angophora,subvelutina,,,F.Muell.,
NSW:NSW:NSW 356099,PhysicalObject,2014-03-21 12:38:00.0,NSW,NSW,PreservedSpecimen,NSW:NSW:NSW 356099,NSW 356099,Spreading tree 16 m tall.,,"Johnson, L.A.S.",,,native,Present,sheet,,,,1970-12-11,,"With Eucalyptus tereticornis on alluvial flat, area now largely cleared.",,,,,,Australia,,New South Wales,,"Araluen Valley, 2 km NW of Araluen on Majors Creek road.","Araluen Valley, 2 km NW of Araluen on Majors Creek road.",,,,,,,,"35,38,,S,149,49,,E,",,,,,-35.63,149.82,,10000.0,,,,,,,,,,,,,,Angophora subvelutina F.Muell.,,,,,Myrtaceae,Angophora,subvelutina,,,F.Muell.,
NSW:NSW:NSW 356100,PhysicalObject,2015-02-05 18:21:00.0,NSW,NSW,PreservedSpecimen,NSW:NSW:NSW 356100,NSW 356100,"[ex Museum of Applied Arts and Sciences, Sydney]",,"Maxwell, L.C.",,fruit,native,Present,sheet,,,,1916-07,,,,,,,,Australia,,New South Wales,,St Marys.,St Marys.,,,,,,,,"33,47,,S,150,47,,E,",,,,,-33.78,150.78,,10000.0,,,,,,,,,,,,,,Angophora subvelutina F.Muell.,,,,,Myrtaceae,Angophora,subvelutina,,,F.Muell.,
NSW:NSW:NSW 356101,PhysicalObject,2014-03-21 12:38:00.0,NSW,NSW,PreservedSpecimen,NSW:NSW:NSW 356101,NSW 356101,"2 trees only (originals) 25-30 ft [7.6-9.1 m]. Bark rough but thin, exposing reddish inner bark in places. Oil dots prominent. Between A. costata & A. intermedia. Neither species in vicinity.",,"Johnson, L.A.S.",,fruit,,Present,sheet,,,,1953-08-11,,North slope. Sandstone.,,,,,,Australia,,New South Wales,,"Leura (Karma, Northcote St, Streets residence)","Leura (Karma, Northcote St, Streets residence)",,945.0,945.0,,,,,"33,43,,S,150,19,,E,",,,,,-33.72,150.32,,10000.0,,,,,,,,,,,,,,Angophora costata x floribunda,,,,,Myrtaceae,Angophora,costata x floribunda,,,,
NSW:NSW:NSW 356102,PhysicalObject,2014-04-27 15:13:00.0,NSW,NSW,PreservedSpecimen,NSW:NSW:NSW 356102,NSW 356102,Large rough-barked trees.,,"Gregson, E.J.",,fruit | sterile,native,Present,sheet,,,,1949-03,,,,,,,,Australia,,New South Wales,,Bowers Creek Road (Mt Tomah district),Bowers Creek Road (Mt Tomah district),,,,,,,,"33,33,,S,150,25,,E,",,,,,-33.55,150.42,,10000.0,,,,,,,,,,,,,,Angophora floribunda (Sm.) Sweet,,,,,Myrtaceae,Angophora,floribunda,,,(Sm.) Sweet,
NSW:NSW:NSW 356103,PhysicalObject,2015-03-31 09:45:00.0,NSW,NSW,PreservedSpecimen,NSW:NSW:NSW 356103,NSW 356103,,,"Blakely, W.F.",,fruit,native,Present,sheet,,,,1928-08,,,,,,,,Australia,,New South Wales,,"Gowan Brae, Parramatta","Gowan Brae, Parramatta",,,,,,,,"33,48,,S,151,01,,E,",,,,,-33.8,151.02,,10000.0,,,,,,,,,,,,,,Angophora floribunda (Sm.) Sweet,,,,,Myrtaceae,Angophora,floribunda,,,(Sm.) Sweet,
NSW:NSW:NSW 356104,PhysicalObject,2018-06-18 13:39:00.0,NSW,NSW,PreservedSpecimen,NSW:NSW:NSW 356104,NSW 356104,"Large tree; petals green outside with white margins, white inside; stamens white.",3166,"Blake, S.T.",,buds,native,Present,sheet,,,,1932-01-14,,In Eucalyptus forest.,,,,,,Australia,,Queensland,,"near Brisbane, W. of Strathpine","near Brisbane, W. of Strathpine",,,,,,,,"27,19,,S,153,00,,E,",,,,,-27.32,153.0,,10000.0,,,,,,,,,,,,,,Angophora floribunda (Sm.) Sweet,,,,,Myrtaceae,Angophora,floribunda,,,(Sm.) Sweet,
NSW:NSW:NSW 356105,PhysicalObject,2018-06-18 13:39:00.0,NSW,NSW,PreservedSpecimen,NSW:NSW:NSW 356105,NSW 356105,"Tree with hard, rough, grey bark.",4198,"Blake, S.T.",,fruit,native,Present,sheet,,,,1932-08-25,,In open forest on hill-top.,,,,,,Australia,,Queensland,,Caloundra.,Caloundra.,,,,,,,,"26,48,,S,153,07,,E,",,,,,-26.8,153.12,,10000.0,,,,,,,,,,,,,,Angophora floribunda (Sm.) Sweet,,,,,Myrtaceae,Angophora,floribunda,,,(Sm.) Sweet,
NSW:NSW:NSW 356106,PhysicalObject,2017-05-29 14:45:00.0,NSW,NSW,PreservedSpecimen,NSW:NSW:NSW 356106,NSW 356106,,6852,"Story, R.",,fruit,native,Present,sheet,,,,1959-10-12,,Common on wooded hills.,,,,,,Australia,,New South Wales,,3 miles [4.8 km] S by E of Ulan,3 miles [4.8 km] S by E of Ulan,,,,,,,,"32,19,,S,149,46,,E,",,,,,-32.32,149.77,,10000.0,,,,,,,,,,,,,,Angophora floribunda (Sm.) Sweet,,,,,Myrtaceae,Angophora,floribunda,,,(Sm.) Sweet,
NSW:NSW:NSW 356107,PhysicalObject,2014-04-27 15:13:00.0,NSW,NSW,PreservedSpecimen,NSW:NSW:NSW 356107,NSW 356107,Rough-barked trees 30-50 ft [9.1-15.2 m].,,"Johnson, L.A.S.",,,,Present,sheet,,,,1951-09-01,,Frequent on sandy (Permian) country and also on Hawkesbury sandstone nr Coricudgy up to 3000 ft [914.4 m].,,,,,,Australia,,New South Wales,,2 m [3.2 km] E of Currans Mt Gap (7 m [11.2 km] E Olinda),2 m [3.2 km] E of Currans Mt Gap (7 m [11.2 km] E Olinda),,762.0,762.0,,,,,"32,50,,S,150,15,,E,",,,,,-32.83,150.25,,10000.0,,,,,,,,,,,,,,Angophora floribunda (Sm.) Sweet,,,,,Myrtaceae,Angophora,floribunda,,,(Sm.) Sweet,
NSW:NSW:NSW 358054,PhysicalObject,2018-02-05 14:36:00.0,NSW,NSW,PreservedSpecimen,NSW:NSW:NSW 358054,NSW 358054,,,"Cheel, E.",,sterile,native,Present,sheet,,,,1912-04,,,,,,,,Australia,,New South Wales,,"Mount Brown, Lake Illawarra","Mount Brown, Lake Illawarra",,,,,,,,"34,33,,S,150,52,,E,",,,,,-34.55,150.87,,10000.0,,,,,,,,,,,,,,Angophora subvelutina F.Muell.,,,,,Myrtaceae,Angophora,subvelutina,,,F.Muell.,
NSW:NSW:NSW 365155,PhysicalObject,2018-07-25 09:01:00.0,NSW,NSW,PreservedSpecimen,NSW:NSW:NSW 365155,NSW 365155,"Locally occasional tree, height 6 m. Brown capsules.",334,"Errington, G.",,fruit,,Present,sheet,,,,1995-02-08,,"Low forest of Eucalyptus gummifera, Eucalyptus haemastoma and Banksia serrata.",,,,,,Australia,,New South Wales,Ku-ring-gai Chase National Park,"Mona Vale Road, 1 km east of St Ives Showground, St Ives,","Mona Vale Road, 1 km east of St Ives Showground, St Ives,",,170.0,170.0,,,,,"33,42,40,S,151,11,50,E,",,,,,-33.7111111,151.1972222,,50.0,,,,,,,,,"Hill, K.D.",1999-12,,,,Angophora crassifolia (G.J.Leach) L.A.S.Johnson & K.D.Hill,,,,,Myrtaceae,Angophora,crassifolia,,,(G.J.Leach) L.A.S.Johnson & K.D.Hill,
NSW:NSW:NSW 365158,PhysicalObject,2018-07-25 09:01:00.0,NSW,NSW,PreservedSpecimen,NSW:NSW:NSW 365158,NSW 365158,"Locally occasional tree, height 6 m. Green/brown capsules.",335,"Errington, G.",,fruit,,Present,sheet,,,,1995-02-08,,"Low forest with Eucalyptus haemastoma, Eucalyptus gummifera, Pimelea linifolia, Banksia serrata and Xanthorrhoea. Thin sandy soil over sandstone.",,,,,,Australia,,New South Wales,Garigal National Park,"Mona Vale Road, 1 km west of Forest Way intersection, Terry Hills,","Mona Vale Road, 1 km west of Forest Way intersection, Terry Hills,",,180.0,180.0,,,,,"33,42,38,S,151,12,07,E,",,,,,-33.7105556,151.2019444,,50.0,,,,,,,,,"Hill, K.D.",1999-12,,,,Angophora crassifolia (G.J.Leach) L.A.S.Johnson & K.D.Hill,,,,,Myrtaceae,Angophora,crassifolia,,,(G.J.Leach) L.A.S.Johnson & K.D.Hill,
NSW:NSW:NSW 365160,PhysicalObject,2018-07-25 09:01:00.0,NSW,NSW,PreservedSpecimen,NSW:NSW:NSW 365160,NSW 365160,"Tree, height 6 m. Green/brown capsules.",336,"Errington, G.",,fruit,,Present,sheet,,,,1995-02-08,,"Low forest near roadside with Eucalyptus haemastoma, Eucalyptus gummifera and weed species. Gravelly loam over sandstone.",,,,,,Australia,,New South Wales,,"Corner of Manor Road and Mona Vale Road, Ingleside.","Corner of Manor Road and Mona Vale Road, Ingleside.",,160.0,160.0,,,,,"33,40,51,S,151,15,52,E,",,,,,-33.6808333,151.2644444,,50.0,,,,,,,,,"Hill, K.D.",1999-12,,,,Angophora crassifolia (G.J.Leach) L.A.S.Johnson & K.D.Hill,,,,,Myrtaceae,Angophora,crassifolia,,,(G.J.Leach) L.A.S.Johnson & K.D.Hill,
NSW:NSW:NSW 370129,PhysicalObject,2018-07-25 09:01:00.0,NSW,NSW,PreservedSpecimen,NSW:NSW:NSW 370129,NSW 370129,"Common. Tree 25 m; bark almost white, somewhat mottled with very light grey patches, smooth, dull, deciduous throughout. [ex BRI AQ 567255]",11419,"Cumming, R.J.",,fruit,native,Present,sheet,,,,1991-10-04,,Woodland/open forest under cliffs with Eucalyptus citriodira and E. acmenoides.,,,,,,Australia,,Queensland,,"Near Torrens Creek Gorge, White Mountains.","Near Torrens Creek Gorge, White Mountains.",,,,,,,,"20,28,,S,144,57,,E,",,,,,-20.47,144.95,,1000.0,,,,,,,,,"Hill, K.D.",1994-03,,,,Angophora leiocarpa (L.A.S.Johnson ex G.J.Leach) K.R.Thiele & Ladiges,,,,,Myrtaceae,Angophora,leiocarpa,,,(L.A.S.Johnson ex G.J.Leach) K.R.Thiele & Ladiges,
NSW:NSW:NSW 370645,PhysicalObject,2018-07-25 09:01:00.0,NSW,NSW,PreservedSpecimen,NSW:NSW:NSW 370645,NSW 370645,Tree 12 m high. Some branches with intermediate leaves. More on sheet. Native at location. [ex NE 044361A],,"Mackay, D.F.",,fruit,,Present,sheet,,,,1987-05-01,,"Roadside dry sclerophyll forest on shallow loam, sandstone parent material.",,,,,,Australia,,New South Wales,,"Urbenville - Tooloom road, c. 5 km S of Urbenville.","Urbenville - Tooloom road, c. 5 km S of Urbenville.",,440.0,440.0,,,,,"28,33,,S,152,25,,E,",,,,,-28.55,152.42,,1000.0,,,,,,,,,"Hill, K.D.",1995-11,,,,Angophora leiocarpa (L.A.S.Johnson ex G.J.Leach) K.R.Thiele & Ladiges,,,,,Myrtaceae,Angophora,leiocarpa,,,(L.A.S.Johnson ex G.J.Leach) K.R.Thiele & Ladiges,
NSW:NSW:NSW 370646,PhysicalObject,2018-07-25 09:01:00.0,NSW,NSW,PreservedSpecimen,NSW:NSW:NSW 370646,NSW 370646,"Tree 15-20 m high, 80 cm diameter. (DFM 00023) 2 sheets. More on sheet. [ex NE 044829A]",00023,"Mackay, D.F.",,fruit,,Present,sheet,,,,1987-06-09,,"Dry sclerophyll forest, undulating topography. Ironbark, stringybark, red gum.",,,,,,Australia,,New South Wales,,"Vinegar Hill road, 5.5 km S of Mount Lindsay Highway.","Vinegar Hill road, 5.5 km S of Mount Lindsay Highway.",,400.0,400.0,,,,,"28,29,,S,152,17,,E,",,,,,-28.48,152.28,,1000.0,,,,,,,,,"Hill, K.D.",1995-11,,,,Angophora leiocarpa (L.A.S.Johnson ex G.J.Leach) K.R.Thiele & Ladiges,,,,,Myrtaceae,Angophora,leiocarpa,,,(L.A.S.Johnson ex G.J.Leach) K.R.Thiele & Ladiges,
NSW:NSW:NSW 370647,PhysicalObject,2018-07-25 09:01:00.0,NSW,NSW,PreservedSpecimen,NSW:NSW:NSW 370647,NSW 370647,Tree 12 m high. (DFM 00906). Native at location. [ex NE 044843A),00906,"Mackay, D.F.",,sterile,native,Present,sheet,,,,1987-05-01,,"Roadside dry sclerophyll forest, with Ironbark, Jacksonia, Themeda. Clay loam.",,,,,,Australia,,New South Wales,,"Urbenville - Bonalbo road, c. 4 km S of Old Bonalbo.","Urbenville - Bonalbo road, c. 4 km S of Old Bonalbo.",,,,,,,,"28,41,,S,152,35,,E,",,,,,-28.68,152.58,,1000.0,,,,,,,,,"Hill, K.D.",1995-11,,,,Angophora leiocarpa (L.A.S.Johnson ex G.J.Leach) K.R.Thiele & Ladiges,,,,,Myrtaceae,Angophora,leiocarpa,,,(L.A.S.Johnson ex G.J.Leach) K.R.Thiele & Ladiges,
NSW:NSW:NSW 370648,PhysicalObject,2014-04-27 15:13:00.0,NSW,NSW,PreservedSpecimen,NSW:NSW:NSW 370648,NSW 370648,tree 10 m high. (DFM 00258) More on sheet. Native at location. [ex NE 046308A],00258,"Mackay, D.F.",,sterile,native,Present,sheet,,,,1987-12-06,,On solodised solonetz in shrub woodland etc.,,,,,,Australia,,New South Wales,Pilliga East State Forest,"Delwood road,","Delwood road,",,,,,,,,"30,48,,S,149,36,,E,",,,,,-30.8,149.6,,1000.0,,,,,,,,,"Mackay, D.F.",1987,,,,Angophora floribunda (Sm.) Sweet,,,,,Myrtaceae,Angophora,floribunda,,,(Sm.) Sweet,
NSW:NSW:NSW 370649,PhysicalObject,2018-07-25 09:01:00.0,NSW,NSW,PreservedSpecimen,NSW:NSW:NSW 370649,NSW 370649,Small spreading tree. More on sheet. Native at location. (Fruit). [ex NE 047100A Magda],,"Mackay, D.F.",,sterile,native,Present,sheet,,,,1988-03-13,,"On sandy soil in woodland of blackbutt, Angophora sp., Acacia sp., etc.",,,,,,Australia,,New South Wales,Yuraygir National Park,"Maclean Brooms Head road,","Maclean Brooms Head road,",,,,,,,,"29,34,,S,153,19,,E,",,,,,-29.57,153.32,,1000.0,,,,,,,,,"Hill, K.D.",1995-11,,,,Angophora paludosa (G.J.Leach) K.R.Thiele & Ladiges,,,,,Myrtaceae,Angophora,paludosa,,,(G.J.Leach) K.R.Thiele & Ladiges,
NSW:NSW:NSW 370650,PhysicalObject,2018-07-25 09:01:00.0,NSW,NSW,PreservedSpecimen,NSW:NSW:NSW 370650,NSW 370650,Tree. Native to location. (Fruit). [ex NE 049928A Magda],,"Mackay, D.F.",,fruit,native,Present,sheet,,,,1987-03,,"On loam on hills in dry sclerophyll forest of E. spp., Ironbark, Acacia.",,,,,,Australia,,New South Wales,,"Mount Lindsay Highway, c. 2 km E of Maryland River.","Mount Lindsay Highway, c. 2 km E of Maryland River.",,,,,,,,"28,28,,S,152,12,,E,",,,,,-28.47,152.2,,1000.0,,,,,,,,,"Hill, K.D.",1995-11,,,,Angophora leiocarpa (L.A.S.Johnson ex G.J.Leach) K.R.Thiele & Ladiges,,,,,Myrtaceae,Angophora,leiocarpa,,,(L.A.S.Johnson ex G.J.Leach) K.R.Thiele & Ladiges,
NSW:NSW:NSW 370651,PhysicalObject,2018-07-25 09:01:00.0,NSW,NSW,PreservedSpecimen,NSW:NSW:NSW 370651,NSW 370651,"Scattered trees, c. 50 m. (DFM 00021) More on sheet. Native to location. [ex NE 044830A].",00021,"Mackay, D.F.",,sterile,,Present,sheet,,,,1987-05-09,,"Dry sclerophyll forest, loam on sandstone parent material.",,,,,,Australia,,New South Wales,,"Koreelah Creek, Mount Lindesay Highway.","Koreelah Creek, Mount Lindesay Highway.",,400.0,400.0,,,,,"28,24,,S,152,23,,E,",,,,,-28.4,152.38,,1000.0,,,,,,,,,"Hill, K.D.",1995-11,,,,Angophora leiocarpa (L.A.S.Johnson ex G.J.Leach) K.R.Thiele & Ladiges,,,,,Myrtaceae,Angophora,leiocarpa,,,(L.A.S.Johnson ex G.J.Leach) K.R.Thiele & Ladiges,
NSW:NSW:NSW 370661,PhysicalObject,2016-11-25 14:15:00.0,NSW,NSW,PreservedSpecimen,NSW:NSW:NSW 370661,NSW 370661,Tree 15 m high. (DFM 00320) More on sheet. Native at location. (Fruit). [ex NE 046329A],00320,"Mackay, D.F.",,sterile,,Present,sheet,,,,1987-09-24,,"On sandy loam in low dry sclerophyll forest with grey gum, scribbly gum, etc.",,,,,,Australia,,New South Wales,Yuraygir National Park,"McLean, Brooms Head Road,","McLean, Brooms Head Road,",,40.0,40.0,,,,,"29,34,,S,153,18,,E,",,,,,-29.57,153.3,,1000.0,,,,,,,,,"Mackay, D.F.",1988,,,,Angophora costata (Gaertn.) Britten,,,,,Myrtaceae,Angophora,costata,,,(Gaertn.) Britten,
NSW:NSW:NSW 370662,PhysicalObject,2016-11-25 14:15:00.0,NSW,NSW,PreservedSpecimen,NSW:NSW:NSW 370662,NSW 370662,Tree 15 m high. (DFM 00315) More on sheet. Native at location. (Fruit). [ex NE 046115A],00315,"Mackay, D.F.",,sterile,,Present,sheet,,,,1987-09-24,,"In dry sclerophyll forest with Banksia, Lomandra, Hibbertia, Callitris etc.",,,,,,Australia,,New South Wales,Bundjalung National Park,"c. 2 km north-northwest radio mast, on the Gap Road,","c. 2 km north-northwest radio mast, on the Gap Road,",,60.0,60.0,,,,,"29,11,,S,153,23,,E,",,,,,-29.18,153.38,,1000.0,,,,,,,,,"Mackay, D.F.",1987,,,,Angophora costata (Gaertn.) Britten,,,,,Myrtaceae,Angophora,costata,,,(Gaertn.) Britten,
NSW:NSW:NSW 370663,PhysicalObject,2016-11-25 14:15:00.0,NSW,NSW,PreservedSpecimen,NSW:NSW:NSW 370663,NSW 370663,(DFM 00302). Native at location. [ex NE 046332A],00302,"Mackay, D.F.",,sterile,native,Present,sheet,,,,1987-09-12,,,,,,,,Australia,,New South Wales,,"Pacific Highway, Melbourne Fire Trail.","Pacific Highway, Melbourne Fire Trail.",,,,,,,,"29,56,,S,153,04,,E,",,,,,-29.93,153.07,,1000.0,,,,,,,,,"Mackay, D.F.",1987,,,,Angophora costata (Gaertn.) Britten,,,,,Myrtaceae,Angophora,costata,,,(Gaertn.) Britten,
NSW:NSW:NSW 370664,PhysicalObject,2016-11-25 14:15:00.0,NSW,NSW,PreservedSpecimen,NSW:NSW:NSW 370664,NSW 370664,Tree 15 m high; bark persisting to major branches. (DFM 00311) More on sheet. Native at location. [ex NE 046330A],00311,"Mackay, D.F.",,fruit,,Present,sheet,,,,1987-09-24,,On grey sandy soil in heath.,,,,,,Australia,,New South Wales,Yuraygir National Park,"McLean, Brooms Head Road,","McLean, Brooms Head Road,",,40.0,40.0,,,,,"29,34,,S,153,18,,E,",,,,,-29.57,153.3,,1000.0,,,,,,,,,"Mackay, D.F.",1987,,,,Angophora costata (Gaertn.) Britten,,,,,Myrtaceae,Angophora,costata,,,(Gaertn.) Britten,
NSW:NSW:NSW 370665,PhysicalObject,2016-11-25 14:15:00.0,NSW,NSW,PreservedSpecimen,NSW:NSW:NSW 370665,NSW 370665,Tree c. 9 m high. (DFM 00278) More on sheet. Native at location. (Fruit). [ex NE 046324A],00278,"Mackay, D.F.",,fruit,native,Present,sheet,,,,1987-09-11,,"On sandy soil in tall woodland on sand dune with Banksia, Imperata etc.",,,,,,Australia,,New South Wales,,c. 300 m S of Red Rock rubbish dump.,c. 300 m S of Red Rock rubbish dump.,,,,,,,,"29,59,,S,153,14,,E,",,,,,-29.98,153.23,,1000.0,,,,,,,,,"Mackay, D.F.",1987,,,,Angophora costata (Gaertn.) Britten,,,,,Myrtaceae,Angophora,costata,,,(Gaertn.) Britten,
NSW:NSW:NSW 370666,PhysicalObject,2016-11-25 14:15:00.0,NSW,NSW,PreservedSpecimen,NSW:NSW:NSW 370666,NSW 370666,"Suppressed tree c. 18 m high, 23 cm dbh. (DFM 00260A) More on sheet. Native at location. (Fruit). [ex NE 046320A]",00260 A,"Mackay, D.F.",,fruit,native,Present,sheet,,,,1987-09-10,,"On clay loam in dry sclerophyll forest with Hardenbergia, tallow wood etc.",,,,,,Australia,,New South Wales,Pine Creek State Forest,"Tobys Road, c. 700 m S of Bonville Road,","Tobys Road, c. 700 m S of Bonville Road,",,,,,,,,"30,24,,S,152,58,,E,",,,,,-30.4,152.97,,1000.0,,,,,,,,,"Mackay, D.F.",1987,,,,Angophora costata (Gaertn.) Britten,,,,,Myrtaceae,Angophora,costata,,,(Gaertn.) Britten,
NSW:NSW:NSW 370667,PhysicalObject,2016-09-26 12:56:00.0,NSW,NSW,PreservedSpecimen,NSW:NSW:NSW 370667,NSW 370667,Small tree. Native at location. [ex NE 048585A Magda],,"White, G.J.",,sterile,,Present,sheet,,,,1988-12-09,,"On skeletal soil in open eucalypt forest of E. moluccana, E. blakelyi, E. melli.",,,,,,Australia,,New South Wales,,"Paddys Land Road, E of Wards Mistake, Paddy Ross ridge.","Paddys Land Road, E of Wards Mistake, Paddy Ross ridge.",,700.0,700.0,,,,,"30,01,,S,152,13,,E,",,,,,-30.02,152.22,,1000.0,,,,,,,,,,,,,,Angophora subvelutina F.Muell.,,,,,Myrtaceae,Angophora,subvelutina,,,F.Muell.,
NSW:NSW:NSW 370668,PhysicalObject,2016-11-25 14:15:00.0,NSW,NSW,PreservedSpecimen,NSW:NSW:NSW 370668,NSW 370668,"Suppressed tree 4 m high, occasional tree to 15 m high. (DFM 00313) More on sheet. Native at location. (Fruit). [ex NE 046326A]",00313,"Mackay, D.F.",,sterile,,Present,sheet,,,,1987-09-24,,"On deep sand on top of sand ridge with Callitris, Banksia, Lomandra, Bossiaea etc.",,,,,,Australia,,New South Wales,,"Angourie Water Reservoir, c. 2 km N of Angourie.","Angourie Water Reservoir, c. 2 km N of Angourie.",,40.0,40.0,,,,,"29,28,,S,153,21,,E,",,,,,-29.47,153.35,,1000.0,,,,,,,,,"Mackay, D.F.",1988,,,,Angophora costata (Gaertn.) Britten,,,,,Myrtaceae,Angophora,costata,,,(Gaertn.) Britten,
NSW:NSW:NSW 370669,PhysicalObject,2016-11-25 14:15:00.0,NSW,NSW,PreservedSpecimen,NSW:NSW:NSW 370669,NSW 370669,Tree 9 m high. (DFM 00277) More on sheet. Native at location. (Fruit). [ex NE 046333A],00277,"Mackay, D.F.",,fruit,native,Present,sheet,,,,1987-09-11,,"On sandy soil in dry sclerophyll woodland with banksia, bracken etc.",,,,,,Australia,,New South Wales,,"0.3 km S of Red Rock tip, 3 km SW of Red Rock.","0.3 km S of Red Rock tip, 3 km SW of Red Rock.",,,,,,,,"29,59,,S,153,14,,E,",,,,,-29.98,153.23,,1000.0,,,,,,,,,"Mackay, D.F.",1988,,,,Angophora costata (Gaertn.) Britten,,,,,Myrtaceae,Angophora,costata,,,(Gaertn.) Britten,
NSW:NSW:NSW 380260,PhysicalObject,2018-07-25 09:01:00.0,NSW,NSW,PreservedSpecimen,NSW:NSW:NSW 380260,NSW 380260,Tree to 18 m high; clusters of cup-shaped soft ribbed capsules; bark rough unevenly furrowed. Locally common. [Ex Queensland Herbarium AQ 600866].,G615,"Grimshaw, P.G.",,fruit,native,Present,sheet,,,,1994-04-19,,"Crest of sandstone ridge; very tall open forest with Eucalyptus acmenoides, E. baileyana, E. planchoniana and Angophora woodsiana; shrubby understorey. Helidon sandstone with lateritic nodules.",,,,,,Australia,,Queensland,State Forest 616,"Seventeen Mile Road Helidon Hills (TR 561),","Seventeen Mile Road Helidon Hills (TR 561),",,,,,,,,"27,28,03,S,152,10,10,E,",,,,,-27.4675,152.1694444,,50.0,,,,,,,,,"Hill, K.D.",1995-04,,,,Angophora woodsiana F.M.Bailey,,,,,Myrtaceae,Angophora,woodsiana,,,F.M.Bailey,
NSW:NSW:NSW 405020,PhysicalObject,2018-07-25 09:01:00.0,NSW,NSW,PreservedSpecimen,NSW:NSW:NSW 405020,NSW 405020,,736,"Tindale, M.D.",,buds | fruit,native,Present,sheet,,,,,,,,,,,,Australia,,New South Wales,,"Gulgong - Wellington Rd, 5.2 miles [8.37 km] N of 2 Mile Flat Creek.","Gulgong - Wellington Rd, 5.2 miles [8.37 km] N of 2 Mile Flat Creek.",,,,,,,,"32,22,,S,149,22,,E,",,,,,-32.37,149.37,,10000.0,,,,,,,,,"Hill, K.D.",1997,,,,Angophora floribunda (Sm.) Sweet,,,,,Myrtaceae,Angophora,floribunda,,,(Sm.) Sweet,
NSW:NSW:NSW 383911,PhysicalObject,2018-07-25 09:01:00.0,NSW,NSW,PreservedSpecimen,NSW:NSW:NSW 383911,NSW 383911,"Mostly growing as shrubs to 3 m but occasionally as small trees to about 5 m of very poor form. Plants flower very heavily & at a very early stage - about 0.5 m tall. ? regrowth from lignotuber to be so precocious. Shrub form erect, leaves of flowering branches stiffly erect. Leaves rather narrower & shorter & fruits larger than the normal local form of Angophora floribunda. Does not grow in same areas as the normal local form but is very common in its own area. Flowers Dec - Jan. Fruits mature mid Feb.",,"Strong, P.",,buds | flowers | fruit | sterile,native,Present,sheet,,,,1995-01-01,,On gravelly clay ridges of slopes. Growing in assocaition with Euc haemostoma & E. gummifera.,,,,,,Australia,,New South Wales,,"Along Arizona Rd, Charmhaven. Map Ref DOORALONG 1-25 000  9131-1-5  593219.","Along Arizona Rd, Charmhaven. Map Ref DOORALONG 1-25 000  9131-1-5  593219.",,,,,,,,"33,14,00,S,151,29,30,E,",,,,,-33.2333333,151.4916667,,1000.0,,,,,,,,,"Hill, K.D.",1995-07,,,,Angophora inopina K.D.Hill,,,,,Myrtaceae,Angophora,inopina,,,K.D.Hill,
NSW:NSW:NSW 387915,PhysicalObject,2018-06-18 10:58:00.0,NSW,NSW,PreservedSpecimen,NSW:NSW:NSW 387915,NSW 387915,"Tree 10 m high. Bark grey, persistent, fibrous. Flowers white. Common along creek.",8353,"Bean, A.R.",,flowers,native,Present,sheet,,,,1995-02-03,,"Woodland of Eucalyptus baileyana, E. bancroftii, Angophora robur, A. paludosa. Shallow sandy soil over sandstone. Common along creek.",,,,,,Australia,,New South Wales,,"Rocky Creek, 28 km from Grafton, towards Coledale.","Rocky Creek, 28 km from Grafton, towards Coledale.",,,,,,,,"29,28,,S,152,51,,E,",,,,,-29.47,152.85,,10000.0,,,,,,,,,,,,,,Angophora paludosa (G.J.Leach) K.R.Thiele & Ladiges,,,,,Myrtaceae,Angophora,paludosa,,,(G.J.Leach) K.R.Thiele & Ladiges,
NSW:NSW:NSW 387917,PhysicalObject,2018-06-18 10:58:00.0,NSW,NSW,PreservedSpecimen,NSW:NSW:NSW 387917,NSW 387917,"Tree 6 m high. Bark grey, rather fibrous. Common at site. Ex BRI: AQ 634321",8352,"Bean, A.R.",,fruit,native,Present,sheet,,,,1995-02-03,,"Woodland of Eucalyptus baileyana, E. bancroftii, Angophora robur, A. paludosa. Shallow sandy soil over sandstone.",,,,,,Australia,,New South Wales,,"Rocky Creek, 28km from Grafton, towards Coaldale.","Rocky Creek, 28km from Grafton, towards Coaldale.",,,,,,,,"29,28,,S,152,51,,E,",,,,,-29.47,152.85,,10000.0,,,,,,,,,,,,,,Angophora robur L.A.S.Johnson & K.D.Hill,,,,,Myrtaceae,Angophora,robur,,,L.A.S.Johnson & K.D.Hill,
NSW:NSW:NSW 388185,PhysicalObject,2013-01-24 14:41:00.0,NSW,NSW,PreservedSpecimen,NSW:NSW:NSW 388185,NSW 388185,"Tree to 10 m high. Rough bark. Flower buds only. Leaves opposite, sessile. Very common. AQ 601281.",G1031,"Grimshaw, P.G.",,buds | fruit,native,Present,sheet,,,,1994-12-08,,"Undulating hilly edge of downs, roadside remnant woodland with Eucalyptus tereticornis and Acacia neriifolia. Main range volcanics - basalt.",,,,,,Australia,,Queensland,,4.2 km along Haden Road from New England Highway turnoff.,4.2 km along Haden Road from New England Highway turnoff.,,,,,,,,"27,14,,S,151,57,,E,",,,,,-27.23,151.95,,25000.0,,,,,,,,,,,,,,Angophora subvelutina F.Muell.,,,,,Myrtaceae,Angophora,subvelutina,,,F.Muell.,
NSW:NSW:NSW 388186,PhysicalObject,2014-04-27 15:13:00.0,NSW,NSW,PreservedSpecimen,NSW:NSW:NSW 388186,NSW 388186,Tree to 15 m high. Flower buds forming in clusters. Leaves opposite with short petiole. Locally common. AQ 601277.,G1035,"Grimshaw, P.G.",,fruit,native,Present,sheet,,,,1994-12-09,,"Watercourse through undulating foothills of Bunya Mountains, roadside remmant riparian woodland. Main range volcanics - basalt.",,,,,,Australia,,Queensland,,"Bunya Mountains, Kingaroy Road, near Stuart River.","Bunya Mountains, Kingaroy Road, near Stuart River.",,,,,,,,"26,44,,S,151,36,,E,",,,,,-26.73,151.6,,25000.0,,,,,,,,,,,,,,Angophora floribunda (Sm.) Sweet,,,,,Myrtaceae,Angophora,floribunda,,,(Sm.) Sweet,
NSW:NSW:NSW 388439,PhysicalObject,2018-07-25 09:01:00.0,NSW,NSW,PreservedSpecimen,NSW:NSW:NSW 388439,NSW 388439,15 - 18 ft [4.5 - 5.4 m] tall. flower at an early age. Flower earlier than A. floribunda.,,"Strong, P.",,fruit,native,Present,sheet,,,,1984-04,,No A. floribunda with this. 2000 acres [809 hectares] in extent in low lying silty soil over clay.,,,,,,Australia,,New South Wales,,Charmhaven.,Charmhaven.,,,,,,,,"33,14,00,S,151,29,00,E,",,,,,-33.2333333,151.4833333,,10000.0,,,,,,,,,"Hill, K.D.",1996-07,,,,Angophora inopina K.D.Hill,,,,,Myrtaceae,Angophora,inopina,,,K.D.Hill,
